[
  {
    "Company": {
      "key": "supplier-os-org-indus~1223RJAMES",
      "name": "Baker Tilly JHB",
      "website": "https://bakertillyjhb.co.za/about/"
    },
    "AboutUs": {
      "Summary": "Baker Tilly JHB’s mission is not only to grow but to grow organically as a result of effective performance achievement, yet always bearing in mind the firm’s strategic objective to remain “small” enough to offer a personalized service to clients, yet “big” enough to produce quality work for clients",
      "Paragraph": {
        "p1": "Baker Tilly JHB Incorporated is a firm of registered auditors and business advisers situated in Johannesburg, with offices in Mulbarton. Through Baker Tilly JHB Services Proprietary Limited we provide accounting, taxation and company secretarial services. Baker Tilly JHB is an independent member of Baker Tilly International.",
        "p2": "Baker Tilly JHB’s mission is not only to grow but to grow organically as a result of effective performance achievement, yet always bearing in mind the firm’s strategic objective to remain “small” enough to offer a personalized service to clients, yet “big” enough to produce quality work for clients.",
        "p3": "Competitive differentiation is focused on superior personalized service. Remaining focused means the firm consistently delivers quality work.",
        "p4": "Our Commitments The shared values of Baker Tilly International and its member firms define what we stand for and how we do things, forming the basis for a consistent approach to service delivery worldwide. Baker Tilly JHB philosophy is to build lasting relationships with our clients, be accessible at all times to service clients’ needs and ensure that we are equipped with the knowledge required to service their needs. Lead by example, Deliver a quality service with an emphasis on integrity, Are open and honest in all communications, Maintain a supportive environment in which their individuals can flourish., Foster teamwork and collaboration with other member firms, Act ethically."
      },
      "Sentence": {
        "s1": "Baker Tilly JHB Incorporated is a firm of registered auditors and business advisers situated in Johannesburg, with offices in Mulbarton",
        "s2": "Through Baker Tilly JHB Services Proprietary Limited we provide accounting, taxation and company secretarial services",
        "s3": "Baker Tilly JHB is an independent member of Baker Tilly International",
        "s4": "Baker Tilly JHB’s mission is not only to grow but to grow organically as a result of effective performance achievement, yet always bearing in mind the firm’s strategic objective to remain “small” enough to offer a personalized service to clients, yet “big” enough to produce quality work for clients",
        "s5": "Competitive differentiation is focused on superior personalized service",
        "s6": "Remaining focused means the firm consistently delivers quality work",
        "s7": "Our Commitments",
        "s8": "The shared values of Baker Tilly International and its member firms define what we stand for and how we do things, forming the basis for a consistent approach to service delivery worldwide",
        "s9": "Baker Tilly JHB philosophy is to build lasting relationships with our clients, be accessible at all times to service clients’ needs and ensure that we are equipped with the knowledge required to service their needs",
        "s10": "Lead by example",
        "s11": "Deliver a quality service with an emphasis on integrity",
        "s12": "Are open and honest in all communications",
        "s13": "Maintain a supportive environment in which their individuals can flourish",
        "s14": "Foster teamwork and collaboration with other member firms",
        "s15": "Act ethically"
      },
      "WholeText": "Baker Tilly JHB Incorporated is a firm of registered auditors and business advisers situated in Johannesburg, with offices in Mulbarton. Through Baker Tilly JHB Services Proprietary Limited we provide accounting, taxation and company secretarial services. Baker Tilly JHB is an independent member of Baker Tilly International. Baker Tilly JHB’s mission is not only to grow but to grow organically as a result of effective performance achievement, yet always bearing in mind the firm’s strategic objective to remain “small” enough to offer a personalized service to clients, yet “big” enough to produce quality work for clients. Competitive differentiation is focused on superior personalized service. Remaining focused means the firm consistently delivers quality work. Our Commitments The shared values of Baker Tilly International and its member firms define what we stand for and how we do things, forming the basis for a consistent approach to service delivery worldwide. Baker Tilly JHB philosophy is to build lasting relationships with our clients, be accessible at all times to service clients’ needs and ensure that we are equipped with the knowledge required to service their needs. Lead by example, Deliver a quality service with an emphasis on integrity, Are open and honest in all communications, Maintain a supportive environment in which their individuals can flourish., Foster teamwork and collaboration with other member firms, Act ethically."
    }
  },
  {
    "Company": {
      "key": "supplier-os-org-guehring~0000049849",
      "name": "Vogel",
      "website": "https://www.vogel.de/ueber-uns/"
    },
    "AboutUs": {
      "Summary": "Vom Fachverlag zur Communications Group Die Vogel Communications Group (VCG) ist mit 790 Mitarbeiter:innen und rund 100 Mio",
      "Paragraph": {
        "p1": "Die Vogel Communications Group (VCG) ist mit 790 Mitarbeiter:innen und rund 100 Mio. Umsatz ein führender Anbieter von Fachkommunikation und Fachinformation. Die Unternehmensgruppe ist im deutschsprachigen Raum an 9 Standorten vertreten, darüber hinaus auch international mit Schwerpunkt China. Die VCG bietet ein gruppeneigenes Agenturnetzwerk aus 8 Kommunikationsagenturen und Service-Unternehmen. Sie ist mit rund 100 Fachmedien in den 5 Wirtschaftsfeldern Automotive, Industrie, Informationstechnologie, Recht/Wirtschaft/Steuern und B2B-Kommunikation/ Marketing verankert. Die VCG bietet für professionelle und erfolgreiche Unternehmenskommunikation 250+ Services, 100+ digitale Plattformen und Communities sowie 300+ Business-Events pro Jahr."
      },
      "Sentence": {
        "s1": "Die Vogel Communications Group (VCG) ist mit 790 Mitarbeiter:innen und rund 100 Mio.",
        "s2": "Umsatz ein führender Anbieter von Fachkommunikation und Fachinformation.",
        "s3": "Die Unternehmensgruppe ist im deutschsprachigen Raum an 9 Standorten vertreten, darüber hinaus auch international mit Schwerpunkt China.",
        "s4": "Die VCG bietet ein gruppeneigenes Agenturnetzwerk aus 8 Kommunikationsagenturen und Service-Unternehmen.",
        "s5": "Sie ist mit rund 100 Fachmedien in den 5 Wirtschaftsfeldern Automotive, Industrie, Informationstechnologie, Recht/Wirtschaft/Steuern und B2B-Kommunikation/ Marketing verankert.",
        "s6": "Die VCG bietet für professionelle und erfolgreiche Unternehmenskommunikation 250+ Services, 100+ digitale Plattformen und Communities sowie 300+ Business-Events pro Jahr."
      },
      "WholeText": "Die Vogel Communications Group (VCG) ist mit 790 Mitarbeiter:innen und rund 100 Mio. Umsatz ein führender Anbieter von Fachkommunikation und Fachinformation. Die Unternehmensgruppe ist im deutschsprachigen Raum an 9 Standorten vertreten, darüber hinaus auch international mit Schwerpunkt China. Die VCG bietet ein gruppeneigenes Agenturnetzwerk aus 8 Kommunikationsagenturen und Service-Unternehmen. Sie ist mit rund 100 Fachmedien in den 5 Wirtschaftsfeldern Automotive, Industrie, Informationstechnologie, Recht/Wirtschaft/Steuern und B2B-Kommunikation/ Marketing verankert. Die VCG bietet für professionelle und erfolgreiche Unternehmenskommunikation 250+ Services, 100+ digitale Plattformen und Communities sowie 300+ Business-Events pro Jahr."
    }
  },
  {
    "Company": {
      "key": "supplier-os-org-mhhannover~10556",
      "name": "AGUETTANT",
      "website": "https://www.aguettant.de/aguettant-deutschland/wer-wir-sind/"
    },
    "AboutUs": {
      "Summary": "Laboratoire Aguettant, ein seit 1903 in Familienbesitz befindliches Pharmaunternehmen, hat sich über viele Jahre zu einem führenden Anbieter im Bereich der Anästhesie, Intensiv- und Notfallmedizin auf dem französischen Heimatmarkt entwickelt",
      "Paragraph": {
        "p1": "Die AGUETTANT Deutschland GmbH wurde im Jahr 2015 gegründet. Als Tochterunternehmen der Laboratoire AGUETTANT sind wir verantwortlich für alle Vertriebsaktivitäten in Deutschland und Österreich.",
        "p2": "Laboratoire Aguettant, ein seit 1903 in Familienbesitz befindliches Pharmaunternehmen, hat sich über viele Jahre zu einem führenden Anbieter im Bereich der Anästhesie, Intensiv- und Notfallmedizin auf dem französischen Heimatmarkt entwickelt. Dank seiner internationalen Struktur und einem Netz von Distributoren ist AGUETTANT heute weltweit in ca. 70 Ländern präsent.",
        "p3": "Unsere Vision ist es, durch Innovationen echte Mehrwerte zu schaffen. Wir möchten Sicherheits- und Qualitätsstandards für Arzneimittel neu definieren, um so Medikationsrisiken für Anwender und Patienten zu minimieren.",
        "p4": "Unser Produktangebot beinhaltet vor allem \"ready-to-administer\" Fertigspritzen und \"ready-to-use\" Lösungen für die Anästhesie, Intensiv- und Notfallmedizin."
      },
      "Sentence": {
        "s1": "Die AGUETTANT Deutschland GmbH wurde im Jahr 2015 gegründet",
        "s2": "Als Tochterunternehmen der Laboratoire AGUETTANT sind wir verantwortlich für alle Vertriebsaktivitäten in Deutschland und Österreich",
        "s3": "Laboratoire Aguettant, ein seit 1903 in Familienbesitz befindliches Pharmaunternehmen, hat sich über viele Jahre zu einem führenden Anbieter im Bereich der Anästhesie, Intensiv- und Notfallmedizin auf dem französischen Heimatmarkt entwickelt",
        "s4": "Dank seiner internationalen Struktur und einem Netz von Distributoren ist AGUETTANT heute weltweit in ca 70 Ländern präsent",
        "s6": "Unsere Vision ist es, durch Innovationen echte Mehrwerte zu schaffen",
        "s7": "Wir möchten Sicherheits- und Qualitätsstandards für Arzneimittel neu definieren, um so Medikationsrisiken für Anwender und Patienten zu minimieren",
        "s8": "Unser Produktangebot beinhaltet vor allem ready-to-administer Fertigspritzen und ready-to-use Lösungen für die Anästhesie, Intensiv- und Notfallmedizin"
      },
      "WholeText": "Die AGUETTANT Deutschland GmbH wurde im Jahr 2015 gegründet. Als Tochterunternehmen der Laboratoire AGUETTANT sind wir verantwortlich für alle Vertriebsaktivitäten in Deutschland und Österreich. Laboratoire Aguettant, ein seit 1903 in Familienbesitz befindliches Pharmaunternehmen, hat sich über viele Jahre zu einem führenden Anbieter im Bereich der Anästhesie, Intensiv- und Notfallmedizin auf dem französischen Heimatmarkt entwickelt. Dank seiner internationalen Struktur und einem Netz von Distributoren ist AGUETTANT heute weltweit in ca. 70 Ländern präsent. Unsere Vision ist es, durch Innovationen echte Mehrwerte zu schaffen. Wir möchten Sicherheits- und Qualitätsstandards für Arzneimittel neu definieren, um so Medikationsrisiken für Anwender und Patienten zu minimieren. Unser Produktangebot beinhaltet vor allem \"ready-to-administer\" Fertigspritzen und \"ready-to-use\" Lösungen für die Anästhesie, Intensiv- und Notfallmedizin."
    }
  },
  {
    "Company": {
      "key": "supplier-os-org-mhhannover~10523",
      "name": "Wendland spice & food",
      "website": "https://www.wendland.eu/"
    },
    "AboutUs": {
      "Summary": "Wir blicken auf eine 40-jährige Unternehmensgeschichte zurück und widmen uns den bestehenden und zukünftigen Herausforderungen in der Lebensmittelbranche",
      "Paragraph": {
        "p1": "Wendland ist ein mittelständisches Unternehmen mit Sitz im Raum Würzburg. Wir blicken auf eine 40-jährige Unternehmensgeschichte zurück und widmen uns den bestehenden und zukünftigen Herausforderungen in der Lebensmittelbranche.",
        "p2": "Unser Kerngeschäft besteht aus Entwicklung und Produktion von hochwertigen Lebensmitteln für Großverbraucher, zu einem Großteil mit Rezepturen nach individuellem Kundenwunsch.",
        "P3": "Gastronomie, Industrie und Markenhersteller vertrauen auf kundenspezifische Lösungen, die wir in großer Bandbreite anbieten können. Wendland liefert Ihr Produkt zur richtigen Zeit an den richtigen Ort, in gewünschter Menge zu einem fairen Preis.",
        "P4": "Das ist unser Auftrag, jeden Tag aufs Neue."
      },
      "Sentence": {
        "s1": "Wendland ist ein mittelständisches Unternehmen mit Sitz im Raum Würzburg.",
        "s2": "Wir blicken auf eine 40-jährige Unternehmensgeschichte zurück und widmen uns den bestehenden und zukünftigen Herausforderungen in der Lebensmittelbranche.",
        "s3": "Unser Kerngeschäft besteht aus Entwicklung und Produktion von hochwertigen Lebensmitteln für Großverbraucher, zu einem Großteil mit Rezepturen nach individuellem Kundenwunsch.",
        "s4": "Gastronomie, Industrie und Markenhersteller vertrauen auf kundenspezifische Lösungen, die wir in großer Bandbreite anbieten können.",
        "s5": "Wendland liefert Ihr Produkt zur richtigen Zeit an den richtigen Ort, in gewünschter Menge zu einem fairen Preis.",
        "s6": "Das ist unser Auftrag, jeden Tag aufs Neue."
      },
      "WholeText": "Wendland ist ein mittelständisches Unternehmen mit Sitz im Raum Würzburg. Wir blicken auf eine 40-jährige Unternehmensgeschichte zurück und widmen uns den bestehenden und zukünftigen Herausforderungen in der Lebensmittelbranche. Unser Kerngeschäft besteht aus Entwicklung und Produktion von hochwertigen Lebensmitteln für Großverbraucher, zu einem Großteil mit Rezepturen nach individuellem Kundenwunsch. Gastronomie, Industrie und Markenhersteller vertrauen auf kundenspezifische Lösungen, die wir in großer Bandbreite anbieten können. Wendland liefert Ihr Produkt zur richtigen Zeit an den richtigen Ort, in gewünschter Menge zu einem fairen Preis. Das ist unser Auftrag, jeden Tag aufs Neue."
    }
  },
  {
    "Company": {
      "key": "supplier-os-org-gesundheit-nordhessen~10619",
      "name": "cs2000",
      "website": "https://www.cs2000.de/"
    },
    "AboutUs": {
      "Summary": "Computer Service 2000 und Vertriebs GmbH ist Ihr engagierter Partner rund um alle Fragen der IT-Hardware und Software für Klein- und Mittelstandsunternehmen und den öffentlichen Dienst in Hannover und Region",
      "Paragraph": {
        "p1": "Computer Service 2000 und Vertriebs GmbH ist Ihr engagierter Partner rund um alle Fragen der IT-Hardware und Software für Klein- und Mittelstandsunternehmen und den öffentlichen Dienst in Hannover und Region. Wir sind spezialisiert auf die Assemblierung von Computern die genau nach Ihren Anforderungen für den Betrieb branchenspezifischer Software produziert werden, Beratung inklusive. Darüber hinaus bieten wir Ihnen die gesamte Palette von Peripheriegeräten führender Hersteller, PC-Reparatur sowie IT-Service.",
        "p2": "Assemblierung Wir bieten Ihnen nach Ihren Anforderungen assemblierte PC- und Servertechnik mit neuester Technologie.",
        "p3": "Peripheriegeräte Peripheriegeräte führender Hersteller nach Maß. Alles auf Ihre Wünsche und Bedürfnisse abgestimmt.",
        "p4": "Druckerlösungen Nur drucken war gestern. Wir bieten Ihnen mit unserem Partner Lexmark modernste Lösungen für die digitale Kommunikation im Unternehmen.",
        "p5": "Service Selbstverständlich installieren wir alle Geräte bei Ihnen und bieten Ihnen gemeinsam mit unserer Schwester WITstor GmbH 360-Grad-Service rund um die IT. Sentence"
      },
      "Sentence": {
        "s1": "Computer Service 2000 und Vertriebs GmbH ist Ihr engagierter Partner rund um alle Fragen der IT-Hardware und Software für Klein- und Mittelstandsunternehmen und den öffentlichen Dienst in Hannover und Region.",
        "s2": "Wir sind spezialisiert auf die Assemblierung von Computern die genau nach Ihren Anforderungen für den Betrieb branchenspezifischer Software produziert werden, Beratung inklusive.",
        "s3": "Darüber hinaus bieten wir Ihnen die gesamte Palette von Peripheriegeräten führender Hersteller, PC-Reparatur sowie IT-Service.",
        "s4": "Assemblierung",
        "s5": "Wir bieten Ihnen nach Ihren Anforderungen assemblierte PC- und Servertechnik mit neuester Technologie.",
        "s6": "Peripheriegeräte",
        "s7": "Peripheriegeräte führender Hersteller nach Maß. Alles auf Ihre Wünsche und Bedürfnisse abgestimmt.",
        "s8": "Druckerlösungen",
        "s9": "Nur drucken war gestern. Wir bieten Ihnen mit unserem Partner Lexmark modernste Lösungen für die digitale Kommunikation im Unternehmen.",
        "s10": "Service",
        "s11": "Selbstverständlich installieren wir alle Geräte bei Ihnen und bieten Ihnen gemeinsam mit unserer Schwester WITstor GmbH 360-Grad-Service rund um die IT. Sentence"
      },
      "": {},
      "WholeText": "Computer Service 2000 und Vertriebs GmbH ist Ihr engagierter Partner rund um alle Fragen der IT-Hardware und Software für Klein- und Mittelstandsunternehmen und den öffentlichen Dienst in Hannover und Region. Wir sind spezialisiert auf die Assemblierung von Computern die genau nach Ihren Anforderungen für den Betrieb branchenspezifischer Software produziert werden, Beratung inklusive. Darüber hinaus bieten wir Ihnen die gesamte Palette von Peripheriegeräten führender Hersteller, PC-Reparatur sowie IT-Service. Assemblierung Wir bieten Ihnen nach Ihren Anforderungen assemblierte PC- und Servertechnik mit neuester Technologie. Peripheriegeräte Peripheriegeräte führender Hersteller nach Maß. Alles auf Ihre Wünsche und Bedürfnisse abgestimmt. Druckerlösungen Nur drucken war gestern. Wir bieten Ihnen mit unserem Partner Lexmark modernste Lösungen für die digitale Kommunikation im Unternehmen. Service Selbstverständlich installieren wir alle Geräte bei Ihnen und bieten Ihnen gemeinsam mit unserer Schwester WITstor GmbH 360-Grad-Service rund um die IT. Sentence"
    }
  },
  {
    "Company": {
      "key": "supplier-os-org-kno~9310162",
      "name": "Raiffeisen-Markt Waren",
      "website": "https://www.rmw-steinwald.de/ueber-uns/wir-ueber-uns"
    },
    "AboutUs": {
      "Summary": "Wir unterhalten Geschäftsstellen in Erbendorf (Lagerhaus, Bau- und Heimwerkermarkt mit Top-Markt, Werkstatt), Kemnath (Lagerhaus mit Baufachmarkt), Neusorg (Agrar-, Bau- und Heimwerkermarkt), Trabitz (Lagerhaus mit Werkstatt), Kirchendemenreuth (Lagerhaus Agrar und Baustoffe) und Kirchenthumbach (Lagerhaus Agrar und Baustoffe, Tankstelle)",
      "Paragraph": {
        "p1": "Die Raiffeisen-Markt Waren GmbH ist ein Tochterunternehmen der Raiffeisenbank Kemnather Land - Steinwald eG  und wurde 1997 gegründet. Unser Hauptsitz ist in Erbendorf (Nordbayern). Wir unterhalten Geschäftsstellen in Erbendorf (Lagerhaus, Bau- und Heimwerkermarkt mit Top-Markt, Werkstatt), Kemnath (Lagerhaus mit Baufachmarkt), Neusorg (Agrar-, Bau- und Heimwerkermarkt), Trabitz (Lagerhaus mit Werkstatt), Kirchendemenreuth (Lagerhaus Agrar und Baustoffe) und Kirchenthumbach (Lagerhaus Agrar und Baustoffe, Tankstelle).",
        "p2": "MITARBEITER. Aktuell beschäftigen wir etwa 65 Mitarbeiter/-innen. Unsere Belegschaft besteht zum überwiegenden Teil aus Mitarbeiter/-innen mit langjähriger Unternehmenszugehörigkeit. Zuverlässige und zufriedene Mitarbeiter/-innen verstehen wir als Grundlage für eine langfristig positive Geschäftsentwicklung. Wir legen Wert auf eine kontinuierliche Fortbildung unserer Belegschaft und fördern diese entsprechend.",
        "p3": "AUSBILDUNG. Die Ausbildung junger Menschen ist uns wichtig. Wir beschäftigen regelmäßig Auszubildende in unseren Geschäftsstellen, sowohl im kaufmännischen als auch im gewerblichen Bereich.",
        "p4": "GESCHÄFTSGEBIET. Unser Geschäftsgebiet liegt in Nordbayern, im westlichen Landkreis Tirschenreuth und umfasst etwa 30 000 ha landwirtschaftliche Nutzfläche in den Agrargebieten 8 (ostbayerisches Mittelgebirge I ) und 8 (ostbayerisches Mittelgebirge II ). Die Land- und Forstwirtschaft hat in unserem Einzugsgebiet einen bedeutenden Stellenwert.",
        "p5": "KUNDEN. Land- und Forstwirte, Gärtner, Gewerbetreibende und Privatpersonen, viele davon als Stammkunden,  schätzen unsere Leistungsstärke. Unsere hohe Qualität bei Produkten und Dienstleistungen, unsere fachmännische Kundenberatung sowie ein ausgeglichenes Preisniveau binden unsere Kunden langfristig an das Unternehmen.",
        "p6": "ANSPRUCH. Durch Leistungsstärke und Kostenbewusstsein sichern wir langfristig unsere Marktposition in unserem Arbeitsgebiet."
      },
      "Sentence": {
        "s1": "Die Raiffeisen-Markt Waren GmbH ist ein Tochterunternehmen der Raiffeisenbank Kemnather Land - Steinwald eG  und wurde 1997 gegründet.",
        "s2": "Unser Hauptsitz ist in Erbendorf (Nordbayern).",
        "s3": "Wir unterhalten Geschäftsstellen in Erbendorf (Lagerhaus, Bau- und Heimwerkermarkt mit Top-Markt, Werkstatt), Kemnath (Lagerhaus mit Baufachmarkt), Neusorg (Agrar-, Bau- und Heimwerkermarkt), Trabitz (Lagerhaus mit Werkstatt), Kirchendemenreuth (Lagerhaus Agrar und Baustoffe) und Kirchenthumbach (Lagerhaus Agrar und Baustoffe, Tankstelle).",
        "s4": "MITARBEITER",
        "s5": "Aktuell beschäftigen wir etwa 65 Mitarbeiter/-innen. Unsere Belegschaft besteht zum überwiegenden Teil aus Mitarbeiter/-innen mit langjähriger Unternehmenszugehörigkeit. Zuverlässige und zufriedene Mitarbeiter/-innen verstehen wir als Grundlage für eine langfristig positive Geschäftsentwicklung. Wir legen Wert auf eine kontinuierliche Fortbildung unserer Belegschaft und fördern diese entsprechend.",
        "s6": "AUSBILDUNG",
        "s7": "Die Ausbildung junger Menschen ist uns wichtig. Wir beschäftigen regelmäßig Auszubildende in unseren Geschäftsstellen, sowohl im kaufmännischen als auch im gewerblichen Bereich.",
        "s8": "GESCHÄFTSGEBIET",
        "s9": "Unser Geschäftsgebiet liegt in Nordbayern, im westlichen Landkreis Tirschenreuth und umfasst etwa 30 000 ha landwirtschaftliche Nutzfläche in den Agrargebieten 8 (ostbayerisches Mittelgebirge I ) und 8 (ostbayerisches Mittelgebirge II ). Die Land- und Forstwirtschaft hat in unserem Einzugsgebiet einen bedeutenden Stellenwert.",
        "s10": "KUNDEN",
        "s11": "Land- und Forstwirte, Gärtner, Gewerbetreibende und Privatpersonen, viele davon als Stammkunden,  schätzen unsere Leistungsstärke. Unsere hohe Qualität bei Produkten und Dienstleistungen, unsere fachmännische Kundenberatung sowie ein ausgeglichenes Preisniveau binden unsere Kunden langfristig an das Unternehmen.",
        "s12": "ANSPRUCH",
        "s13": "Durch Leistungsstärke und Kostenbewusstsein sichern wir langfristig unsere Marktposition in unserem Arbeitsgebiet."
      },
      "WholeText": "Die Raiffeisen-Markt Waren GmbH ist ein Tochterunternehmen der Raiffeisenbank Kemnather Land - Steinwald eG  und wurde 1997 gegründet. Unser Hauptsitz ist in Erbendorf (Nordbayern). Wir unterhalten Geschäftsstellen in Erbendorf (Lagerhaus, Bau- und Heimwerkermarkt mit Top-Markt, Werkstatt), Kemnath (Lagerhaus mit Baufachmarkt), Neusorg (Agrar-, Bau- und Heimwerkermarkt), Trabitz (Lagerhaus mit Werkstatt), Kirchendemenreuth (Lagerhaus Agrar und Baustoffe) und Kirchenthumbach (Lagerhaus Agrar und Baustoffe, Tankstelle). MITARBEITER. Aktuell beschäftigen wir etwa 65 Mitarbeiter/-innen. Unsere Belegschaft besteht zum überwiegenden Teil aus Mitarbeiter/-innen mit langjähriger Unternehmenszugehörigkeit. Zuverlässige und zufriedene Mitarbeiter/-innen verstehen wir als Grundlage für eine langfristig positive Geschäftsentwicklung. Wir legen Wert auf eine kontinuierliche Fortbildung unserer Belegschaft und fördern diese entsprechend. AUSBILDUNG. Die Ausbildung junger Menschen ist uns wichtig. Wir beschäftigen regelmäßig Auszubildende in unseren Geschäftsstellen, sowohl im kaufmännischen als auch im gewerblichen Bereich. GESCHÄFTSGEBIET. Unser Geschäftsgebiet liegt in Nordbayern, im westlichen Landkreis Tirschenreuth und umfasst etwa 30 000 ha landwirtschaftliche Nutzfläche in den Agrargebieten 8 (ostbayerisches Mittelgebirge I ) und 8 (ostbayerisches Mittelgebirge II ). Die Land- und Forstwirtschaft hat in unserem Einzugsgebiet einen bedeutenden Stellenwert. KUNDEN. Land- und Forstwirte, Gärtner, Gewerbetreibende und Privatpersonen, viele davon als Stammkunden,  schätzen unsere Leistungsstärke. Unsere hohe Qualität bei Produkten und Dienstleistungen, unsere fachmännische Kundenberatung sowie ein ausgeglichenes Preisniveau binden unsere Kunden langfristig an das Unternehmen. ANSPRUCH. Durch Leistungsstärke und Kostenbewusstsein sichern wir langfristig unsere Marktposition in unserem Arbeitsgebiet."
    }
  },
  {
    "Company": {
      "key": "supplier-os-org-kno~9312967",
      "name": "Soldan",
      "website": "https://www.soldan.de/unternehmen"
    },
    "AboutUs": {
      "Summary": "Anwälte, Notare, Steuerberater und Wirtschaftsprüfer finden bei Soldan alles, was sie für den modernen Kanzleialltag benötigen: Hard- und Softwarelösungen, auch rund um das besondere elektronische Anwaltspostfach (beA), Spracherkennung und Diktiersysteme, Print- und Online-Fachmedien sowie diverse Kanzleidienstleistungen für Sekretariatsaufgaben, Datenschutz oder Kanzleimarketing",
      "Paragraph": {
        "p1": "Die fortschreitende Digitalisierung revolutioniert den Rechtsberatungsmarkt. Neue Beratungsangebote entstehen. Gleichzeitig verändern digitale Lösungen die Arbeitsabläufe in den Kanzleien.",
        "p2": "Soldan begleitet und unterstützt Anwälte, Notare, Steuerberater und Wirtschaftsprüfer bei diesen Herausforderungen. Vom Versandhändler haben wir uns längst zu einem innovativen Lösungsanbieter für Kanzleien entwickelt.",
        "p3": "Trotz aller Veränderungen bleiben wir unseren Unternehmensgrundsätzen treu. Wir bieten Produkte und Dienstleistungen in hoher Qualität, fachlich up to date und zuverlässig zu einem guten Preis-/Leistungsverhältnis an.",
        "p4": "Die Geschäftsidee geht auf den Anwalt Hans Soldan zurück. Er gründete vor mehr als 100 Jahren das Unternehmen, um Berufskollegen mit hochwertigen Büroartikeln zu erschwinglichen Preisen zu versorgen. Diesem Auftrag folgen wir bis heute und pflegen intensive Partnerschaften mit den Berufsträgern, Kammern und Verbänden.",
        "p5": "Die gemeinnützige Soldan Stiftung fördert Institutionen der Anwaltschaft und universitäre Einrichtungen. Dazu zählt auch das unabhängige Soldan Institut, das als einzige Einrichtung in Deutschland empirische Forschung über und für den Berufsstand betreibt. Unsere hohe Fachkompetenz, unser Engagement und unsere Tradition haben dazu beigetragen, dass Soldan eine feste Institution in der deutschen Anwaltschaft ist. Immerhin zählen 90 Prozent der Anwälte und Notare zu unseren Kunden.",
        "p6": "Soldan unterstützt seine Kunden beim Aufbruch in das digitale Zeitalter mit einem umfangreichen Produkt- und Dienstleistungsangebot.",
        "p7": "Anwälte, Notare, Steuerberater und Wirtschaftsprüfer finden bei Soldan alles, was sie für den modernen Kanzleialltag benötigen: Hard- und Softwarelösungen, auch rund um das besondere elektronische Anwaltspostfach (beA), Spracherkennung und Diktiersysteme, Print- und Online-Fachmedien sowie diverse Kanzleidienstleistungen für Sekretariatsaufgaben, Datenschutz oder Kanzleimarketing.",
        "p8": "Selbstverständlich befinden sich auch sämtliche Büroartikel sowie spezifischer Kanzleibedarf in unserem Sortiment. Individuelle Druckaufträge erledigt zuverlässig und schnell unsere Druckerei.",
        "p9": "Ständig sondiert Soldan den Markt nach neuen Produkten und Ideen, die die Arbeit in der Kanzlei effizienter machen. Zusammen mit Partnern entwickeln wir deshalb auch eigene Lösungen. Ein Beispiel dafür ist die innovative Cloud-Kanzleisoftware rainmaker, die wir zur führenden Legal Tech-Plattform ausbauen wollen.",
        "p10": "Kontinuierlich wächst ebenfalls unser Seminar- und Kongressangebot. Zusammen mit Wolters Kluwer Deutschland realisiert Soldan unter der Marke „Anwaltszukunftskongress“ Veranstaltungen, die sich mit den radikalen Veränderungen auf dem Rechtsberatungsmarkt beschäftigen. Der „Deutsche Rechtsfachwirttag“ ist inzwischen die größte Fortbildungsveranstaltung für Kanzleimitarbeiter in Deutschland.",
        "p11": "Unser Anspruch ist es, unsere Kunden zu entlasten, damit sie den Kopf frei haben für die wichtigen Fälle."
      },
      "Sentence": {
        "s1": "Die fortschreitende Digitalisierung revolutioniert den Rechtsberatungsmarkt.",
        "s2": "Neue Beratungsangebote entstehen.",
        "s3": "Gleichzeitig verändern digitale Lösungen die Arbeitsabläufe in den Kanzleien.",
        "s4": "Soldan begleitet und unterstützt Anwälte, Notare, Steuerberater und Wirtschaftsprüfer bei diesen Herausforderungen.",
        "s5": "Vom Versandhändler haben wir uns längst zu einem innovativen Lösungsanbieter für Kanzleien entwickelt.",
        "s6": "Trotz aller Veränderungen bleiben wir unseren Unternehmensgrundsätzen treu.",
        "s7": "Wir bieten Produkte und Dienstleistungen in hoher Qualität, fachlich up to date und zuverlässig zu einem guten Preis-/Leistungsverhältnis an.",
        "s8": "Die Geschäftsidee geht auf den Anwalt Hans Soldan zurück.",
        "s9": "Er gründete vor mehr als 100 Jahren das Unternehmen, um Berufskollegen mit hochwertigen Büroartikeln zu erschwinglichen Preisen zu versorgen.",
        "s10": "Diesem Auftrag folgen wir bis heute und pflegen intensive Partnerschaften mit den Berufsträgern, Kammern und Verbänden.",
        "s11": "Die gemeinnützige Soldan Stiftung fördert Institutionen der Anwaltschaft und universitäre Einrichtungen.",
        "s12": "Dazu zählt auch das unabhängige Soldan Institut, das als einzige Einrichtung in Deutschland empirische Forschung über und für den Berufsstand betreibt.",
        "s13": "Unsere hohe Fachkompetenz, unser Engagement und unsere Tradition haben dazu beigetragen, dass Soldan eine feste Institution in der deutschen Anwaltschaft ist.",
        "s14": "Immerhin zählen 90 Prozent der Anwälte und Notare zu unseren Kunden.",
        "s15": "Soldan unterstützt seine Kunden beim Aufbruch in das digitale Zeitalter mit einem umfangreichen Produkt- und Dienstleistungsangebot.",
        "s16": "Anwälte, Notare, Steuerberater und Wirtschaftsprüfer finden bei Soldan alles, was sie für den modernen Kanzleialltag benötigen: Hard- und Softwarelösungen, auch rund um das besondere elektronische Anwaltspostfach (beA), Spracherkennung und Diktiersysteme, Print- und Online-Fachmedien sowie diverse Kanzleidienstleistungen für Sekretariatsaufgaben, Datenschutz oder Kanzleimarketing.",
        "s17": "Selbstverständlich befinden sich auch sämtliche Büroartikel sowie spezifischer Kanzleibedarf in unserem Sortiment.",
        "s18": "Individuelle Druckaufträge erledigt zuverlässig und schnell unsere Druckerei.",
        "s19": "Ständig sondiert Soldan den Markt nach neuen Produkten und Ideen, die die Arbeit in der Kanzlei effizienter machen.",
        "s20": "Zusammen mit Partnern entwickeln wir deshalb auch eigene Lösungen. Ein Beispiel dafür ist die innovative Cloud-Kanzleisoftware rainmaker, die wir zur führenden Legal Tech-Plattform ausbauen wollen.",
        "s21": "Kontinuierlich wächst ebenfalls unser Seminar- und Kongressangebot. Zusammen mit Wolters Kluwer Deutschland realisiert Soldan unter der Marke „Anwaltszukunftskongress“ Veranstaltungen, die sich mit den radikalen Veränderungen auf dem Rechtsberatungsmarkt beschäftigen.",
        "s22": "Der „Deutsche Rechtsfachwirttag“ ist inzwischen die größte Fortbildungsveranstaltung für Kanzleimitarbeiter in Deutschland.",
        "s23": "Unser Anspruch ist es, unsere Kunden zu entlasten, damit sie den Kopf frei haben für die wichtigen Fälle."
      },
      "WholeText": "Die fortschreitende Digitalisierung revolutioniert den Rechtsberatungsmarkt. Neue Beratungsangebote entstehen. Gleichzeitig verändern digitale Lösungen die Arbeitsabläufe in den Kanzleien. Soldan begleitet und unterstützt Anwälte, Notare, Steuerberater und Wirtschaftsprüfer bei diesen Herausforderungen. Vom Versandhändler haben wir uns längst zu einem innovativen Lösungsanbieter für Kanzleien entwickelt. Trotz aller Veränderungen bleiben wir unseren Unternehmensgrundsätzen treu. Wir bieten Produkte und Dienstleistungen in hoher Qualität, fachlich up to date und zuverlässig zu einem guten Preis-/Leistungsverhältnis an. Die Geschäftsidee geht auf den Anwalt Hans Soldan zurück. Er gründete vor mehr als 100 Jahren das Unternehmen, um Berufskollegen mit hochwertigen Büroartikeln zu erschwinglichen Preisen zu versorgen. Diesem Auftrag folgen wir bis heute und pflegen intensive Partnerschaften mit den Berufsträgern, Kammern und Verbänden. Die gemeinnützige Soldan Stiftung fördert Institutionen der Anwaltschaft und universitäre Einrichtungen. Dazu zählt auch das unabhängige Soldan Institut, das als einzige Einrichtung in Deutschland empirische Forschung über und für den Berufsstand betreibt. Unsere hohe Fachkompetenz, unser Engagement und unsere Tradition haben dazu beigetragen, dass Soldan eine feste Institution in der deutschen Anwaltschaft ist. Immerhin zählen 90 Prozent der Anwälte und Notare zu unseren Kunden. Soldan unterstützt seine Kunden beim Aufbruch in das digitale Zeitalter mit einem umfangreichen Produkt- und Dienstleistungsangebot. Anwälte, Notare, Steuerberater und Wirtschaftsprüfer finden bei Soldan alles, was sie für den modernen Kanzleialltag benötigen: Hard- und Softwarelösungen, auch rund um das besondere elektronische Anwaltspostfach (beA), Spracherkennung und Diktiersysteme, Print- und Online-Fachmedien sowie diverse Kanzleidienstleistungen für Sekretariatsaufgaben, Datenschutz oder Kanzleimarketing. Selbstverständlich befinden sich auch sämtliche Büroartikel sowie spezifischer Kanzleibedarf in unserem Sortiment. Individuelle Druckaufträge erledigt zuverlässig und schnell unsere Druckerei. Ständig sondiert Soldan den Markt nach neuen Produkten und Ideen, die die Arbeit in der Kanzlei effizienter machen. Zusammen mit Partnern entwickeln wir deshalb auch eigene Lösungen. Ein Beispiel dafür ist die innovative Cloud-Kanzleisoftware rainmaker, die wir zur führenden Legal Tech-Plattform ausbauen wollen. Kontinuierlich wächst ebenfalls unser Seminar- und Kongressangebot. Zusammen mit Wolters Kluwer Deutschland realisiert Soldan unter der Marke „Anwaltszukunftskongress“ Veranstaltungen, die sich mit den radikalen Veränderungen auf dem Rechtsberatungsmarkt beschäftigen. Der „Deutsche Rechtsfachwirttag“ ist inzwischen die größte Fortbildungsveranstaltung für Kanzleimitarbeiter in Deutschland. Unser Anspruch ist es, unsere Kunden zu entlasten, damit sie den Kopf frei haben für die wichtigen Fälle."
    }
  },
  {
    "Company": {
      "key": "supplier-os-org-ukwuerzburg~0000102123",
      "name": "stephan",
      "website": "https://www.stephan-gmbh.com/unternehmen/"
    },
    "AboutUs": {
      "Summary": "Wir suchen den Austausch und pflegen den Diskurs, weil wir wissen, dass diese Auseinandersetzung mit unterschiedlichen Sichtweisen und Anforderungen, der Weg ist, der uns zu unserem Ziel führt: der optimalen Lösung für Patienten auf der ganzen Welt",
      "Paragraph": {
        "p1": "Beatmung – besonders die von Früh- und Neugeborenen – ist unser Spezialgebiet. Hier haben wir uns als Technologieführer weltweit einen Namen gemacht. Und tun jeden Tag alles dafür, Mediziner und Pflegepersonal mit unseren Geräten und Lösungen bei ihrem Einsatz für kleine und große Patienten optimal zu unterstützen.",
        "p2": "Basis unseres erfolgreichen Wirkens ist die enge Zusammenarbeit mit den Menschen, die unsere Geräte jeden Tag einsetzen. Im stetigen Kontakt mit ihnen erfahren wir, vor welchen Herausforderungen sie stehen, lernen konkrete Bedarfe kennen und entwickeln auf diese Weise Geräte, die immer noch besser auf die Bedürfnisse von Patienten und Pflegenden abgestimmt sind. Dabei haben Sicherheit und Verlässlichkeit für uns oberste Priorität.",
        "p3": "Zu unserem Leistungsspektrum gehören neben der Beatmungstechnik auch Sauerstoffversorgungssysteme, die als Anlagen gemäß Richtlinie 2006/42/EG sowohl in Krankenhäusern als auch bei Militär und Katastrophenschutz zum Einsatz kommen.",
        "p4": "Rainer Hafermann und Bernd Höhne Verantwortungsbewusstsein, Innovationsfreude, technische Kompetenz und medizinische Erfahrung sind die Eckpfeiler unserer Arbeit. Dafür stehen insbesondere Rainer Hafermann als geschäftsführender Gesellschafter und Bernd Höhne als Geschäftsführer der Fritz Stephan GmbH.",
        "p5": "Forschen und entwickeln – das passiert bei uns nicht im stillen Kämmerlein, sondern in engem Austausch zwischen Medizinern, Anwendern, Technikern und Entwicklern. Wir suchen den Austausch und pflegen den Diskurs, weil wir wissen, dass diese Auseinandersetzung mit unterschiedlichen Sichtweisen und Anforderungen, der Weg ist, der uns zu unserem Ziel führt: der optimalen Lösung für Patienten auf der ganzen Welt.",
        "p6": "Unsere Techniker und Entwickler gehören zu den besten Köpfen der deutschen Medizintechnik. Sie brennen für ihre Aufgaben und arbeiten zugleich absolut gewissenhaft und genau. Denn das ist in unserem Metier unverzichtbar. Schließlich tragen wir Verantwortung für Menschenleben. Und dessen sind wir uns jeden Tag bewusst."
      },
      "Sentence": {
        "s1": "Beatmung – besonders die von Früh- und Neugeborenen – ist unser Spezialgebiet.",
        "s2": "Hier haben wir uns als Technologieführer weltweit einen Namen gemacht.",
        "s3": "Und tun jeden Tag alles dafür, Mediziner und Pflegepersonal mit unseren Geräten und Lösungen bei ihrem Einsatz für kleine und große Patienten optimal zu unterstützen.",
        "s4": "Basis unseres erfolgreichen Wirkens ist die enge Zusammenarbeit mit den Menschen, die unsere Geräte jeden Tag einsetzen.",
        "s5": "Im stetigen Kontakt mit ihnen erfahren wir, vor welchen Herausforderungen sie stehen, lernen konkrete Bedarfe kennen und entwickeln auf diese Weise Geräte, die immer noch besser auf die Bedürfnisse von Patienten und Pflegenden abgestimmt sind.",
        "s6": "Dabei haben Sicherheit und Verlässlichkeit für uns oberste Priorität.",
        "s7": "Zu unserem Leistungsspektrum gehören neben der Beatmungstechnik auch Sauerstoffversorgungssysteme, die als Anlagen gemäß Richtlinie 2006/42/EG sowohl in Krankenhäusern als auch bei Militär und Katastrophenschutz zum Einsatz kommen.",
        "s8": "Rainer Hafermann und Bernd Höhne Verantwortungsbewusstsein, Innovationsfreude, technische Kompetenz und medizinische Erfahrung sind die Eckpfeiler unserer Arbeit.",
        "s9": "Dafür stehen insbesondere Rainer Hafermann als geschäftsführender Gesellschafter und Bernd Höhne als Geschäftsführer der Fritz Stephan GmbH.",
        "s10": "Forschen und entwickeln – das passiert bei uns nicht im stillen Kämmerlein, sondern in engem Austausch zwischen Medizinern, Anwendern, Technikern und Entwicklern.",
        "s11": "Wir suchen den Austausch und pflegen den Diskurs, weil wir wissen, dass diese Auseinandersetzung mit unterschiedlichen Sichtweisen und Anforderungen, der Weg ist, der uns zu unserem Ziel führt: der optimalen Lösung für Patienten auf der ganzen Welt.",
        "s12": "Unsere Techniker und Entwickler gehören zu den besten Köpfen der deutschen Medizintechnik.",
        "s13": "Sie brennen für ihre Aufgaben und arbeiten zugleich absolut gewissenhaft und genau.",
        "s14": "Denn das ist in unserem Metier unverzichtbar.",
        "s15": "Schließlich tragen wir Verantwortung für Menschenleben.",
        "s16": "Und dessen sind wir uns jeden Tag bewusst."
      },
      "WholeText": "Beatmung – besonders die von Früh- und Neugeborenen – ist unser Spezialgebiet. Hier haben wir uns als Technologieführer weltweit einen Namen gemacht. Und tun jeden Tag alles dafür, Mediziner und Pflegepersonal mit unseren Geräten und Lösungen bei ihrem Einsatz für kleine und große Patienten optimal zu unterstützen. Basis unseres erfolgreichen Wirkens ist die enge Zusammenarbeit mit den Menschen, die unsere Geräte jeden Tag einsetzen. Im stetigen Kontakt mit ihnen erfahren wir, vor welchen Herausforderungen sie stehen, lernen konkrete Bedarfe kennen und entwickeln auf diese Weise Geräte, die immer noch besser auf die Bedürfnisse von Patienten und Pflegenden abgestimmt sind. Dabei haben Sicherheit und Verlässlichkeit für uns oberste Priorität. Zu unserem Leistungsspektrum gehören neben der Beatmungstechnik auch Sauerstoffversorgungssysteme, die als Anlagen gemäß Richtlinie 2006/42/EG sowohl in Krankenhäusern als auch bei Militär und Katastrophenschutz zum Einsatz kommen. Rainer Hafermann und Bernd Höhne Verantwortungsbewusstsein, Innovationsfreude, technische Kompetenz und medizinische Erfahrung sind die Eckpfeiler unserer Arbeit. Dafür stehen insbesondere Rainer Hafermann als geschäftsführender Gesellschafter und Bernd Höhne als Geschäftsführer der Fritz Stephan GmbH. Forschen und entwickeln – das passiert bei uns nicht im stillen Kämmerlein, sondern in engem Austausch zwischen Medizinern, Anwendern, Technikern und Entwicklern. Wir suchen den Austausch und pflegen den Diskurs, weil wir wissen, dass diese Auseinandersetzung mit unterschiedlichen Sichtweisen und Anforderungen, der Weg ist, der uns zu unserem Ziel führt: der optimalen Lösung für Patienten auf der ganzen Welt. Unsere Techniker und Entwickler gehören zu den besten Köpfen der deutschen Medizintechnik. Sie brennen für ihre Aufgaben und arbeiten zugleich absolut gewissenhaft und genau. Denn das ist in unserem Metier unverzichtbar. Schließlich tragen wir Verantwortung für Menschenleben. Und dessen sind wir uns jeden Tag bewusst."
    }
  },
  {
    "Company": {
      "key": "supplier-os-org-ukkoeln~1003178",
      "name": "aap Implantate AG",
      "website": "https://www.aap.de/unternehmen/unternehmensprofil"
    },
    "AboutUs": {
      "Summary": "Während wir unsere Produkte in Deutschland direkt an Krankenhäuser, Einkaufsgemeinschaften und Verbundkliniken vertreiben, nutzen wir auf internationaler Ebene primär ein breites Distributorennetzwerk in rund 25 Ländern",
      "Paragraph": {
        "p1": "Wir sind ein global tätiges Medizintechnikunternehmen mit Sitz in Berlin, Deutschland. Wir entwickeln, produzieren und vermarkten Produkte für die Traumatologie. Unser IP-geschütztes Portfolio umfasst neben dem innovativen anatomischen Plattensystem LOQTEQ® ein weites Spektrum an Lochschrauben. Darüber hinaus verfügen wir über eine Innovationspipeline mit vielversprechenden Entwicklungs­projekten, wie unserer antibakterielle Silberbeschichtungs­technologie und unseren magnesiumbasierten Implantaten. Diese Technologien adressieren kritische und bislang noch nicht adäquat gelöste Probleme in der Traumatologie.",
        "p2": "Während wir unsere Produkte in Deutschland direkt an Krankenhäuser, Einkaufsgemeinschaften und Verbundkliniken vertreiben, nutzen wir auf internationaler Ebene primär ein breites Distributorennetzwerk in rund 25 Ländern. In den USA setzen wir mit unserer Tochtergesellschaft aap Implants Inc. auf eine hybride Vertriebsstrategie. Dabei erfolgt der Vertrieb sowohl über Distributionsagenten als auch im Rahmen von Partnerschaften mit globalen Orthopädieunternehmen.",
        "p3": "Wir sind ein börsennotiertes Unternehmen und unsere Aktie ist im General Standard der Frankfurter Wertpapierbörse gelistet (XETRA: AAQ.DE)."
      },
      "Sentence": {
        "s1": "Wir sind ein global tätiges Medizintechnikunternehmen mit Sitz in Berlin, Deutschland.",
        "s2": "Wir entwickeln, produzieren und vermarkten Produkte für die Traumatologie.",
        "s3": "Unser IP-geschütztes Portfolio umfasst neben dem innovativen anatomischen Plattensystem LOQTEQ® ein weites Spektrum an Lochschrauben.",
        "s4": "Darüber hinaus verfügen wir über eine Innovationspipeline mit vielversprechenden Entwicklungs­projekten, wie unserer antibakterielle Silberbeschichtungs­technologie und unseren magnesiumbasierten Implantaten.",
        "s5": "Diese Technologien adressieren kritische und bislang noch nicht adäquat gelöste Probleme in der Traumatologie.",
        "s6": "Während wir unsere Produkte in Deutschland direkt an Krankenhäuser, Einkaufsgemeinschaften und Verbundkliniken vertreiben, nutzen wir auf internationaler Ebene primär ein breites Distributorennetzwerk in rund 25 Ländern.",
        "s7": "In den USA setzen wir mit unserer Tochtergesellschaft aap Implants Inc. auf eine hybride Vertriebsstrategie.",
        "s8": "Dabei erfolgt der Vertrieb sowohl über Distributionsagenten als auch im Rahmen von Partnerschaften mit globalen Orthopädieunternehmen.",
        "s9": "Wir sind ein börsennotiertes Unternehmen und unsere Aktie ist im General Standard der Frankfurter Wertpapierbörse gelistet (XETRA: AAQ.DE)."
      },
      "WholeText": "Wir sind ein global tätiges Medizintechnikunternehmen mit Sitz in Berlin, Deutschland. Wir entwickeln, produzieren und vermarkten Produkte für die Traumatologie. Unser IP-geschütztes Portfolio umfasst neben dem innovativen anatomischen Plattensystem LOQTEQ® ein weites Spektrum an Lochschrauben. Darüber hinaus verfügen wir über eine Innovationspipeline mit vielversprechenden Entwicklungs­projekten, wie unserer antibakterielle Silberbeschichtungs­technologie und unseren magnesiumbasierten Implantaten. Diese Technologien adressieren kritische und bislang noch nicht adäquat gelöste Probleme in der Traumatologie. Während wir unsere Produkte in Deutschland direkt an Krankenhäuser, Einkaufsgemeinschaften und Verbundkliniken vertreiben, nutzen wir auf internationaler Ebene primär ein breites Distributorennetzwerk in rund 25 Ländern. In den USA setzen wir mit unserer Tochtergesellschaft aap Implants Inc. auf eine hybride Vertriebsstrategie. Dabei erfolgt der Vertrieb sowohl über Distributionsagenten als auch im Rahmen von Partnerschaften mit globalen Orthopädieunternehmen. Wir sind ein börsennotiertes Unternehmen und unsere Aktie ist im General Standard der Frankfurter Wertpapierbörse gelistet (XETRA: AAQ.DE)."
    }
  },
  {
    "Company": {
      "key": "supplier-os-org-ukkoeln~1600413",
      "name": "Mediaform Druckprodukte",
      "website": "https://www.mediaform.de/unternehmen"
    },
    "AboutUs": {
      "Summary": "Neben rund 1000 deutschen Krankenhäusern ist sie heute Lieferant und Logistikpartner der meisten deutschen Laboratorien und versorgt so direkt und indirekt über 30",
      "Paragraph": {
        "p1": "Mediaform Druckprodukte Im Jahre 1990 gegründet, versorgte die Mediaform Druckprodukte GmbH anfangs primär Krankenhäuser mit technisch anspruchsvollen Formularlösungen. Neben rund 1000 deutschen Krankenhäusern ist sie heute Lieferant und Logistikpartner der meisten deutschen Laboratorien und versorgt so direkt und indirekt über 30.000 niedergelassene Ärzte mit Etiketten und Formularen."
      },
      "Sentence": {
        "s1": "Mediaform Druckprodukte",
        "s2": "Im Jahre 1990 gegründet, versorgte die Mediaform Druckprodukte GmbH anfangs primär Krankenhäuser mit technisch anspruchsvollen Formularlösungen.",
        "s3": "Neben rund 1.000 deutschen Krankenhäusern ist sie heute Lieferant und Logistikpartner der meisten deutschen Laboratorien und versorgt so direkt und indirekt über 30.000 niedergelassene Ärzte mit Etiketten und Formularen."
      },
      "WholeText": "Mediaform Druckprodukte Im Jahre 1990 gegründet, versorgte die Mediaform Druckprodukte GmbH anfangs primär Krankenhäuser mit technisch anspruchsvollen Formularlösungen. Neben rund 1000 deutschen Krankenhäusern ist sie heute Lieferant und Logistikpartner der meisten deutschen Laboratorien und versorgt so direkt und indirekt über 30.000 niedergelassene Ärzte mit Etiketten und Formularen."
    }
  },
  {
    "Company": {
      "key": "supplier-os-org-ukkoeln~1609013",
      "name": "kohlpharma",
      "website": "https://www.kohlpharma.com/ueber-uns/"
    },
    "AboutUs": {
      "Summary": "Auch in Brüssel kämpfen wir im Europäischen Dachverband „Affordable Medicines Europe“ für einen funktionierenden Binnenmarkt und den freien Warenverkehr, der Voraussetzung für die Einsparungen durch EU-weiten Wettbewerb ist",
      "Paragraph": {
        "p1": "Seit der Unternehmensgründung im Jahre 1979 – und damit seit über 40 Jahren – hat kohlpharma den Arzneimittel-Import in Deutschland kontinuierlich ausgebaut.",
        "p2": "Wir nutzen die unterschiedlichen Preise der multinationalen Pharmakonzerne für ein und dasselbe Präparat in den jeweiligen EU-Ländern.",
        "p3": "Auf diese Weise können wir auch Patienten in Deutschland mit den bekannten Originalpräparaten namhafter Hersteller versorgen – und sind dabei durchschnittlich circa 10 Prozent preiswerter.",
        "p4": "Bei vielen Präparaten ist die Ersparnis sogar noch höher. Davon profitieren sowohl Patienten als auch gesetzliche Krankenkassen.",
        "p5": "Allein die direkten Einsparungen aus den Preisunterschieden betragen nachweislich 400 Millionen Euro im Jahr*. Der EU-weite Wettbewerb zwischen Herstellern und Importeuren bewirkt zudem, dass sich Preise und Preiserhöhungen der Pharmaindustrie spürbar im Rahmen halten. Dies resultiert in weiteren Einsparungen von aktuell 4,4 Milliarden Euro pro Jahr**. Somit leisten wir einen wichtigen Beitrag zur Sicherstellung einer kostenbewussten Arzneimittelversorgung.",
        "p6": "Als familiengeführtes und unabhängiges mittelständisches Unternehmen sind uns auch die Bedürfnisse und Interessen unserer Kunden wichtig – Apotheken und pharmazeutischem Großhandel. Dabei liegt uns vor allem die Stärkung der inhabergeführten Vor-Ort-Apotheke am Herzen. Sie ist das Rückgrat einer patientenorientierten Arzneimittelversorgung in ganz Deutschland.",
        "p7": "kohlpharma wird seine marktführende Position auch in Zukunft dazu nutzen, aktiv an der Sicherstellung einer bezahlbaren und patientennahen Medikamentenversorgung mitzuwirken und einen maßgeblichen Beitrag hierzu zu leisten.",
        "p8": "Dazu engagieren wir uns in gesundheits- und sozialpolitischen Diskussionen auf Landes- und Bundesebene im Verband der Arzneimittel-Importeure e.V. (VAD), sowie in der verbändeübergreifenden Dachinitiative „Die Arzneimittel-Importeure“.",
        "p9": "Auch in Brüssel kämpfen wir im Europäischen Dachverband „Affordable Medicines Europe“ für einen funktionierenden Binnenmarkt und den freien Warenverkehr, der Voraussetzung für die Einsparungen durch EU-weiten Wettbewerb ist."
      },
      "Sentence": {
        "s1": "Seit der Unternehmensgründung im Jahre 1979 – und damit seit über 40 Jahren – hat kohlpharma den Arzneimittel-Import in Deutschland kontinuierlich ausgebaut.",
        "s2": "Wir nutzen die unterschiedlichen Preise der multinationalen Pharmakonzerne für ein und dasselbe Präparat in den jeweiligen EU-Ländern.",
        "s3": "Auf diese Weise können wir auch Patienten in Deutschland mit den bekannten Originalpräparaten namhafter Hersteller versorgen – und sind dabei durchschnittlich circa 10 Prozent preiswerter.",
        "s4": "Bei vielen Präparaten ist die Ersparnis sogar noch höher.",
        "s5": "Davon profitieren sowohl Patienten als auch gesetzliche Krankenkassen.",
        "s6": "Allein die direkten Einsparungen aus den Preisunterschieden betragen nachweislich 400 Millionen Euro im Jahr*.",
        "s7": "Der EU-weite Wettbewerb zwischen Herstellern und Importeuren bewirkt zudem, dass sich Preise und Preiserhöhungen der Pharmaindustrie spürbar im Rahmen halten.",
        "s8": "Dies resultiert in weiteren Einsparungen von aktuell 4,4 Milliarden Euro pro Jahr**.",
        "s9": "Somit leisten wir einen wichtigen Beitrag zur Sicherstellung einer kostenbewussten Arzneimittelversorgung.",
        "s10": "Als familiengeführtes und unabhängiges mittelständisches Unternehmen sind uns auch die Bedürfnisse und Interessen unserer Kunden wichtig – Apotheken und pharmazeutischem Großhandel.",
        "s11": "Dabei liegt uns vor allem die Stärkung der inhabergeführten Vor-Ort-Apotheke am Herzen.",
        "s12": "Sie ist das Rückgrat einer patientenorientierten Arzneimittelversorgung in ganz Deutschland.",
        "s13": "kohlpharma wird seine marktführende Position auch in Zukunft dazu nutzen, aktiv an der Sicherstellung einer bezahlbaren und patientennahen Medikamentenversorgung mitzuwirken und einen maßgeblichen Beitrag hierzu zu leisten.",
        "s14": "Dazu engagieren wir uns in gesundheits- und sozialpolitischen Diskussionen auf Landes- und Bundesebene im Verband der Arzneimittel-Importeure e.V. (VAD), sowie in der verbändeübergreifenden Dachinitiative „Die Arzneimittel-Importeure“.",
        "s15": "Auch in Brüssel kämpfen wir im Europäischen Dachverband „Affordable Medicines Europe“ für einen funktionierenden Binnenmarkt und den freien Warenverkehr, der Voraussetzung für die Einsparungen durch EU-weiten Wettbewerb ist."
      },
      "WholeText": "Seit der Unternehmensgründung im Jahre 1979 – und damit seit über 40 Jahren – hat kohlpharma den Arzneimittel-Import in Deutschland kontinuierlich ausgebaut. Wir nutzen die unterschiedlichen Preise der multinationalen Pharmakonzerne für ein und dasselbe Präparat in den jeweiligen EU-Ländern. Auf diese Weise können wir auch Patienten in Deutschland mit den bekannten Originalpräparaten namhafter Hersteller versorgen – und sind dabei durchschnittlich circa 10 Prozent preiswerter. Bei vielen Präparaten ist die Ersparnis sogar noch höher. Davon profitieren sowohl Patienten als auch gesetzliche Krankenkassen. Allein die direkten Einsparungen aus den Preisunterschieden betragen nachweislich 400 Millionen Euro im Jahr*. Der EU-weite Wettbewerb zwischen Herstellern und Importeuren bewirkt zudem, dass sich Preise und Preiserhöhungen der Pharmaindustrie spürbar im Rahmen halten. Dies resultiert in weiteren Einsparungen von aktuell 4,4 Milliarden Euro pro Jahr**. Somit leisten wir einen wichtigen Beitrag zur Sicherstellung einer kostenbewussten Arzneimittelversorgung. Als familiengeführtes und unabhängiges mittelständisches Unternehmen sind uns auch die Bedürfnisse und Interessen unserer Kunden wichtig – Apotheken und pharmazeutischem Großhandel. Dabei liegt uns vor allem die Stärkung der inhabergeführten Vor-Ort-Apotheke am Herzen. Sie ist das Rückgrat einer patientenorientierten Arzneimittelversorgung in ganz Deutschland. kohlpharma wird seine marktführende Position auch in Zukunft dazu nutzen, aktiv an der Sicherstellung einer bezahlbaren und patientennahen Medikamentenversorgung mitzuwirken und einen maßgeblichen Beitrag hierzu zu leisten. Dazu engagieren wir uns in gesundheits- und sozialpolitischen Diskussionen auf Landes- und Bundesebene im Verband der Arzneimittel-Importeure e.V. (VAD), sowie in der verbändeübergreifenden Dachinitiative „Die Arzneimittel-Importeure“. Auch in Brüssel kämpfen wir im Europäischen Dachverband „Affordable Medicines Europe“ für einen funktionierenden Binnenmarkt und den freien Warenverkehr, der Voraussetzung für die Einsparungen durch EU-weiten Wettbewerb ist."
    }
  },
  {
    "Company": {
      "key": "supplier-os-org-ukmuenster~20000107",
      "name": "Beiersdorf",
      "website": "https://www.beiersdorf.de/ueber-uns/unser-profil/unser-purpose"
    },
    "AboutUs": {
      "Summary": "Indem wir unsere Stärken bündeln, Vertrauen aufbauen und neue Lösungswege suchen, schaffen wir wertvolle menschliche Verbindungen, auch mit unseren Konsument*innen und der Gesellschaft auf der ganzen Welt",
      "Paragraph": {
        "p1": "Hautpflege steht im Mittelpunkt all unseres Handelns. Seit über 140 Jahren begleitet Beiersdorf das Leben von Menschen: Wir sorgen für gesunde, schöne Haut und damit auch für inneres Wohlbefinden.",
        "p2": "Indem wir dafür sorgen, dass sich die Menschen in ihrer Haut wohlfühlen, geben wir ihnen das Vertrauen, das sie brauchen, um aufeinander zuzugehen und wertvolle menschliche Beziehungen aufzubauen. In einer zunehmend isolierten Welt helfen wir ihnen, eine Bindung aufzubauen, die mehr als nur hautnah ist: eine Verbindung, die auf Vertrauen, Empathie und Fürsorge beruht.",
        "p3": "Unser Verständnis von Pflege geht seit jeher weiter. Wenn wir zusammenarbeiten und unsere Kräfte vereinen, bieten wir nicht nur Hautpflege an, sondern pflegen auch das, was für das Leben der Menschen wichtig ist. Innerhalb unseres Unternehmens pflegen wir eine Kultur des Respekts und der universellen Werte, die sich auch auf andere Menschen und Familien in vielen Ländern der Welt auswirkt. Auf gesellschaftlicher Ebene weiten wir unsere Fürsorge auf unsere Mitmenschen sowie den Planeten aus und leisten einen Beitrag zum Zusammenhalt von Gemeinschaften.",
        "p4": "Indem wir unsere Stärken bündeln, Vertrauen aufbauen und neue Lösungswege suchen, schaffen wir wertvolle menschliche Verbindungen, auch mit unseren Konsument*innen und der Gesellschaft auf der ganzen Welt.",
        "p5": "Unsere Pflege und Fürsorge gehen über die der Haut hinaus. Das ist unser Purpose und unsere Motivation. To care beyond skin."
      },
      "Sentence": {
        "s1": "Hautpflege steht im Mittelpunkt all unseres Handelns. Seit über 140 Jahren begleitet Beiersdorf das Leben von Menschen: Wir sorgen für gesunde, schöne Haut und damit auch für inneres Wohlbefinden.",
        "s2": "Indem wir dafür sorgen, dass sich die Menschen in ihrer Haut wohlfühlen, geben wir ihnen das Vertrauen, das sie brauchen, um aufeinander zuzugehen und wertvolle menschliche Beziehungen aufzubauen.",
        "s3": "In einer zunehmend isolierten Welt helfen wir ihnen, eine Bindung aufzubauen, die mehr als nur hautnah ist: eine Verbindung, die auf Vertrauen, Empathie und Fürsorge beruht.",
        "s4": "Unser Verständnis von Pflege geht seit jeher weiter. Wenn wir zusammenarbeiten und unsere Kräfte vereinen, bieten wir nicht nur Hautpflege an, sondern pflegen auch das, was für das Leben der Menschen wichtig ist.",
        "s5": "Innerhalb unseres Unternehmens pflegen wir eine Kultur des Respekts und der universellen Werte, die sich auch auf andere Menschen und Familien in vielen Ländern der Welt auswirkt.",
        "s6": "Auf gesellschaftlicher Ebene weiten wir unsere Fürsorge auf unsere Mitmenschen sowie den Planeten aus und leisten einen Beitrag zum Zusammenhalt von Gemeinschaften.",
        "s7": "Indem wir unsere Stärken bündeln, Vertrauen aufbauen und neue Lösungswege suchen, schaffen wir wertvolle menschliche Verbindungen, auch mit unseren Konsument*innen und der Gesellschaft auf der ganzen Welt.",
        "s8": "Unsere Pflege und Fürsorge gehen über die der Haut hinaus.",
        "s9": "Das ist unser Purpose und unsere Motivation. To care beyond skin."
      },
      "WholeText": "Hautpflege steht im Mittelpunkt all unseres Handelns. Seit über 140 Jahren begleitet Beiersdorf das Leben von Menschen: Wir sorgen für gesunde, schöne Haut und damit auch für inneres Wohlbefinden. Indem wir dafür sorgen, dass sich die Menschen in ihrer Haut wohlfühlen, geben wir ihnen das Vertrauen, das sie brauchen, um aufeinander zuzugehen und wertvolle menschliche Beziehungen aufzubauen. In einer zunehmend isolierten Welt helfen wir ihnen, eine Bindung aufzubauen, die mehr als nur hautnah ist: eine Verbindung, die auf Vertrauen, Empathie und Fürsorge beruht. Unser Verständnis von Pflege geht seit jeher weiter. Wenn wir zusammenarbeiten und unsere Kräfte vereinen, bieten wir nicht nur Hautpflege an, sondern pflegen auch das, was für das Leben der Menschen wichtig ist. Innerhalb unseres Unternehmens pflegen wir eine Kultur des Respekts und der universellen Werte, die sich auch auf andere Menschen und Familien in vielen Ländern der Welt auswirkt. Auf gesellschaftlicher Ebene weiten wir unsere Fürsorge auf unsere Mitmenschen sowie den Planeten aus und leisten einen Beitrag zum Zusammenhalt von Gemeinschaften. Indem wir unsere Stärken bündeln, Vertrauen aufbauen und neue Lösungswege suchen, schaffen wir wertvolle menschliche Verbindungen, auch mit unseren Konsument*innen und der Gesellschaft auf der ganzen Welt. Unsere Pflege und Fürsorge gehen über die der Haut hinaus. Das ist unser Purpose und unsere Motivation. To care beyond skin."
    }
  },
  {
    "Company": {
      "key": "supplier-os-org-ukmuenster~20024589",
      "name": "infofabrik",
      "website": "https://www.infofabrik.de/company"
    },
    "AboutUs": {
      "Summary": "Seit der Gründung der InfoFabrik GmbH in 2005 entwickeln und vertreiben wir Anwendungssoftware, verwalten die Daten unserer Kunden und bauen Ihre BI-Systeme auf beziehungsweise aus",
      "Paragraph": {
        "p1": "Seit der Gründung der InfoFabrik GmbH in 2005 entwickeln und vertreiben wir Anwendungssoftware, verwalten die Daten unserer Kunden und bauen Ihre BI-Systeme auf beziehungsweise aus. Im Jahr 2016 haben wir mit unserem langjährigen Partner Jan Albrecht und seiner Firma datenwerke fusioniert, woraus die InfoFabrik GmbH entstand.",
        "p2": "Das Know-how und die Fachkompetenz unserer Mitarbeiter sind wesentliche Stützpfeiler für die gute Zusammenarbeit mit unseren Kunden. Zu vielen unserer Kunden pflegen wir schon über lange Jahre hinweg vertrauensvolle Geschäftsbeziehungen. Für dieses Vertrauen setzen wir uns jeden Tag aufs Neue ein.",
        "p3": "Das menschliche Miteinander im Arbeitsleben ist eine entscheidende Größe für eine erfolgreiche Geschäftstätigkeit. Wir engagieren uns deshalb dafür, stets konstruktive Beziehungen zwischen Mitarbeitern, Kunden und Partnern aufzubauen. Unsere Arbeitskultur basiert sowohl auf einem offenen und ehrlichen Dialog zwischen unseren Mitarbeitern untereinander, als auch zwischen unseren Mitarbeitern und unseren Kunden.",
        "p4": "Die fach-, sach- und termingerechte Abwicklung unserer Aufträge ist für uns selbstverständlich. Dadurch wird die InfoFabrik GmbH zu einem dynamisch wachsenden und erfolgreichen Beratungsunternehmen."
      },
      "Sentence": {
        "s1": "Seit der Gründung der InfoFabrik GmbH in 2005 entwickeln und vertreiben wir Anwendungssoftware, verwalten die Daten unserer Kunden und bauen Ihre BI-Systeme auf beziehungsweise aus.",
        "s2": "Im Jahr 2016 haben wir mit unserem langjährigen Partner Jan Albrecht und seiner Firma datenwerke fusioniert, woraus die InfoFabrik GmbH entstand.",
        "s3": "Das Know-how und die Fachkompetenz unserer Mitarbeiter sind wesentliche Stützpfeiler für die gute Zusammenarbeit mit unseren Kunden.",
        "s4": "Zu vielen unserer Kunden pflegen wir schon über lange Jahre hinweg vertrauensvolle Geschäftsbeziehungen.",
        "s5": "Für dieses Vertrauen setzen wir uns jeden Tag aufs Neue ein.",
        "s6": "Das menschliche Miteinander im Arbeitsleben ist eine entscheidende Größe für eine erfolgreiche Geschäftstätigkeit.",
        "s7": "Wir engagieren uns deshalb dafür, stets konstruktive Beziehungen zwischen Mitarbeitern, Kunden und Partnern aufzubauen.",
        "s8": "Unsere Arbeitskultur basiert sowohl auf einem offenen und ehrlichen Dialog zwischen unseren Mitarbeitern untereinander, als auch zwischen unseren Mitarbeitern und unseren Kunden.",
        "s9": "Die fach-, sach- und termingerechte Abwicklung unserer Aufträge ist für uns selbstverständlich.",
        "s10": "Dadurch wird die InfoFabrik GmbH zu einem dynamisch wachsenden und erfolgreichen Beratungsunternehmen."
      },
      "WholeText": "Seit der Gründung der InfoFabrik GmbH in 2005 entwickeln und vertreiben wir Anwendungssoftware, verwalten die Daten unserer Kunden und bauen Ihre BI-Systeme auf beziehungsweise aus. Im Jahr 2016 haben wir mit unserem langjährigen Partner Jan Albrecht und seiner Firma datenwerke fusioniert, woraus die InfoFabrik GmbH entstand. Das Know-how und die Fachkompetenz unserer Mitarbeiter sind wesentliche Stützpfeiler für die gute Zusammenarbeit mit unseren Kunden. Zu vielen unserer Kunden pflegen wir schon über lange Jahre hinweg vertrauensvolle Geschäftsbeziehungen. Für dieses Vertrauen setzen wir uns jeden Tag aufs Neue ein. Das menschliche Miteinander im Arbeitsleben ist eine entscheidende Größe für eine erfolgreiche Geschäftstätigkeit. Wir engagieren uns deshalb dafür, stets konstruktive Beziehungen zwischen Mitarbeitern, Kunden und Partnern aufzubauen. Unsere Arbeitskultur basiert sowohl auf einem offenen und ehrlichen Dialog zwischen unseren Mitarbeitern untereinander, als auch zwischen unseren Mitarbeitern und unseren Kunden. Die fach-, sach- und termingerechte Abwicklung unserer Aufträge ist für uns selbstverständlich. Dadurch wird die InfoFabrik GmbH zu einem dynamisch wachsenden und erfolgreichen Beratungsunternehmen."
    }
  },
  {
    "Company": {
      "key": "supplier-os-org-baeko~42174",
      "name": "AHA360",
      "website": "https://www.aha360.com/unternehmen"
    },
    "AboutUs": {
      "Summary": "Zwei Frauen sitzen sich in einer Sitznische gegenueber und unterhalten sichBaeckereifachverkaeuferin haelt Brot in der Hand und steht vor individuellem BrotregalHand beruehrt die Rinde eines Baumes Frau lauft durch einen lichtdurchfluteten Raum Drei Maenner die gemeinsam einen Wagen eine Rampe hochschieben Unsere Erfolgsgeschichte in Zahlen 3",
      "Paragraph": {
        "p1": "Die AHA GmbH in Gersthofen gibt Menschen Raum. In weit über 3.000 realisierten Projekten. Innerhalb unseres eingespielten Teams. Mit hochindividuellen, bedarfsgerechten Lösungen und Konzepten. Seit unserer Gründung im Jahr 1997 sind wir aneinander und miteinander gewachsen.",
        "p2": "Aus einer Leidenschaft für Holz wurde einer der erfolgreichsten Ladenbau- Spezialisten. Aus unseren Planern, Designern und Schreinern eine starke Gemeinschaft. Und aus so manchem langjährigen Kundenkontakt eine freundschaftliche Beziehung."
      },
      "Sentence": {
        "s1": "Die AHA GmbH in Gersthofen gibt Menschen Raum",
        "s2": "In weit über 3.000 realisierten Projekten",
        "s3": "Innerhalb unseres eingespielten Teams",
        "s4": "Mit hochindividuellen, bedarfsgerechten Lösungen und Konzepten",
        "s5": "Seit unserer Gründung im Jahr 1997 sind wir aneinander und miteinander gewachsen",
        "s6": "Aus einer Leidenschaft für Holz wurde einer der erfolgreichsten Ladenbau- Spezialisten",
        "s7": "Aus unseren Planern, Designern und Schreinern eine starke Gemeinschaft",
        "s8": "Und aus so manchem langjährigen Kundenkontakt eine freundschaftliche Beziehung"
      },
      "WholeText": "Die AHA GmbH in Gersthofen gibt Menschen Raum. In weit über 3.000 realisierten Projekten. Innerhalb unseres eingespielten Teams. Mit hochindividuellen, bedarfsgerechten Lösungen und Konzepten. Seit unserer Gründung im Jahr 1997 sind wir aneinander und miteinander gewachsen. Aus einer Leidenschaft für Holz wurde einer der erfolgreichsten Ladenbau- Spezialisten. Aus unseren Planern, Designern und Schreinern eine starke Gemeinschaft. Und aus so manchem langjährigen Kundenkontakt eine freundschaftliche Beziehung."
    }
  },
  {
    "Company": {
      "key": "supplier-os-org-ukwuerzburg~0000120807",
      "name": "Institut für Medizinische Mikrobiologie, Immunologie und Hygiene",
      "website": "https://mikrobio.med.tum.de/de/home/%C3%BCber-uns"
    },
    "AboutUs": {
      "Summary": "In den Bereichen Forschung, Lehre, Verwaltung und Diagnostik arbeiten insgesamt rund 150 Mitarbeiterinnen und Mitarbeiter gemeinsam in einer modernen und leistungsfähigen Funktionseinheit, deren Arbeitsschwerpunkte sich in der Erforschung von Erreger-Wirt-Interaktionen wiederfinden",
      "Paragraph": {
        "p1": "Das Institut für Medizinische Mikrobiologie, Immunologie und Hygiene (MIH) ist innerhalb der TUM School of Medicine and Health am Campus des Klinikums rechts der Isar angesiedelt. In den Bereichen Forschung, Lehre, Verwaltung und Diagnostik arbeiten insgesamt rund 150 Mitarbeiterinnen und Mitarbeiter gemeinsam in einer modernen und leistungsfähigen Funktionseinheit, deren Arbeitsschwerpunkte sich in der Erforschung von Erreger-Wirt-Interaktionen wiederfinden."
      },
      "Sentence": {
        "s1": "Das Institut für Medizinische Mikrobiologie, Immunologie und Hygiene (MIH) ist innerhalb der TUM School of Medicine and Health am Campus des Klinikums rechts der Isar angesiedelt.",
        "s2": "In den Bereichen Forschung, Lehre, Verwaltung und Diagnostik arbeiten insgesamt rund 150 Mitarbeiterinnen und Mitarbeiter gemeinsam in einer modernen und leistungsfähigen Funktionseinheit, deren Arbeitsschwerpunkte sich in der Erforschung von Erreger-Wirt-Interaktionen wiederfinden."
      },
      "WholeText": "Das Institut für Medizinische Mikrobiologie, Immunologie und Hygiene (MIH) ist innerhalb der TUM School of Medicine and Health am Campus des Klinikums rechts der Isar angesiedelt. In den Bereichen Forschung, Lehre, Verwaltung und Diagnostik arbeiten insgesamt rund 150 Mitarbeiterinnen und Mitarbeiter gemeinsam in einer modernen und leistungsfähigen Funktionseinheit, deren Arbeitsschwerpunkte sich in der Erforschung von Erreger-Wirt-Interaktionen wiederfinden."
    }
  },
  {
    "Company": {
      "key": "supplier-os-org-ukkoeln~1360094",
      "name": "sarstedt",
      "website": {
        "w1": "https://www.sarstedt.com/unternehmen/ueber-uns/sortiment/",
        "w2": "https://www.sarstedt.com/unternehmen/ueber-uns/kurzprofil/"
      }
    },
    "AboutUs": {
      "Summary": "Breites Portfolio in Diagnostik, Labor, Medical, Transfusion und Laborautomation Unsere Produkte und Lösungen kommen in der medizinischen Versorgung und den unterschiedlichsten Laboren weltweit zum Einsatz",
      "Paragraph": {
        "p1": "Wir entwickeln, produzieren und vertreiben Geräte und Verbrauchsmaterial für Medizin und Wissenschaft. Weltweit sind wir als einer der führenden Anbieter dieser Branche anerkannt.",
        "p2": "Breites Portfolio in Diagnostik, Labor, Medical, Transfusion und Laborautomation Unsere Produkte und Lösungen kommen in der medizinischen Versorgung und den unterschiedlichsten Laboren weltweit zum Einsatz. Hierzu zählt u.a. die Routine-Diagnostik im medizinischen Labor sowie die universitäre / industrielle Forschung und Analytik. Somit legen wir die Grundlage für eine exakte Diagnostik von Erkrankungen im Human- und Veterinärbereich. Darüber hinaus tragen unsere Materialien zur Forschung und Entwicklung neuer Medikamente und Verfahren zu einer weltweit verbesserten Gesundheitsversorgung bei. Als globaler Anbieter stehen wir für ein außergewöhnlich breites Produktportfolio, das sich grundsätzlich in fünf Sparten unterteilt:",
        "p3": "DIAGNOSTIK Wir bieten eines der umfangreichsten Portfolios für präanalytische Prozesse an. Hierzu gehören  Produkte zur optimalen und sicheren Probenentnahme, für den Transport und die Lagerung diagnostischer Proben.  Hierbei stellen wir unseren Kunden unterschiedliche Probenentnahmesysteme für die diversen Probenmaterialien Blut, Speichel, Urin oder Stuhl zur Verfügung. Kunden und Anwender unserer Produkte sind u.a. Kliniken, Arztpraxen, medizinische Labore und Blutbanken.",
        "p4": "LABOR Wir bieten maßgeschneiderte Produktlösungen für die verschiedenen Einsatzgebiete der Molekularbiologie, Biochemie, Zellbiologie und weiterer Bereiche. Eine stets auf die Anwendung angepasste Produktqualität ermöglicht dabei höchste Reproduzierbarkeit in der Analytik. Reinraumbedingungen und automatisierte Produktionsprozesse sind die Grundvoraussetzungen für die zertifizierten SARSTEDT-Qualitätsstandards „PCR Performance Tested“ und „Biosphere® plus\". Hierdurch können wir auch geringste Kontaminationen zuverlässig ausschließen und unseren Kunden dabei zu jeder Zeit die nötige Sicherheit in der Routine gewährleisten. Natürlich passen wir die Zertifizierungen dafür kontinuierlich dem aktuellen Forschungsstand an.",
        "p5": "KLINIK Die Schwerpunkte im Produktsegment der klinischen Versorgung bilden die Bereiche Regionalanästhesie und Urinableitungssysteme. Unser jahrzehntelanges Know-How in der Entwicklung und die Qualität der milliardenfachen Produktion von Blutentnahmekanülen wurden auf die Herstellung unserer Regionalanästhesie-Kanülen übertragen. Des Weiteren stellen wir zur patientengerechten Versorgung von Inkontinenz- bzw. Katheterpatienten Urinableitungssysteme inkl. Zubehör zur Verfügung, die entsprechend unseres eigenen Anspruchs eine sichere und hygienische Patientenbehandlung sicherstellen.",
        "p6": "TRANSFUSIONSMEDIZIN Bei uns hat Transfusionstechnologie System. Daher nutzen wir modernste Technik bei der Gewinnung, Verarbeitung und Anwendung von Blutkonserven. Wir bieten ein umfassendes Produktspektrum, damit wir unsere Kunden in den vielfältigen Bereichen der Transfusionsmedizin anwenderfreundlich, effizient und sicher unterstützen können. Bestes Beispiel ist unsere Blutmischwaage TOPSWING. Mit ihrer innovativen, dreidimensionalen Mischbewegung sichert die TOPSWING die Vermischung von Antikoagulanz und Blut.",
        "p7": "LABORAUTOMATION Bereits Mitte der 90er Jahre haben wir damit begonnen, Laborautomatisierungssysteme zu entwickeln. So haben wir unsere Kompetenz als Systemlösungsanbieter kontinuierlich ausgebaut und können unsere Kunden mit nunmehr jahrzehntelanger Erfahrung als Partner bei der Gestaltung von optimalen und effizienten Prozessen im Labor unterstützen. Im Vordergrund steht dabei, die Prozesse sicherer, präziser und wirtschaftlicher zu gestalten. Angeboten werden modulare Automatisierungslösungen für intelligentes Sortieren, Verteilen, Aliquotieren etc. bei prä- und postanalytischen Prozessen in klinischen und mikrobiologischen Bereichen."
      },
      "Sentence": {
        "s1": "Wir entwickeln, produzieren und vertreiben Geräte und Verbrauchsmaterial für Medizin und Wissenschaft.",
        "s2": "Weltweit sind wir als einer der führenden Anbieter dieser Branche anerkannt.",
        "s3": "Breites Portfolio in Diagnostik, Labor, Medical, Transfusion und Laborautomation Unsere Produkte und Lösungen kommen in der medizinischen Versorgung und den unterschiedlichsten Laboren weltweit zum Einsatz.",
        "s4": "Hierzu zählt u.a. die Routine-Diagnostik im medizinischen Labor sowie die universitäre / industrielle Forschung und Analytik.",
        "s5": "Somit legen wir die Grundlage für eine exakte Diagnostik von Erkrankungen im Human- und Veterinärbereich.",
        "s6": "Darüber hinaus tragen unsere Materialien zur Forschung und Entwicklung neuer Medikamente und Verfahren zu einer weltweit verbesserten Gesundheitsversorgung bei.",
        "s7": "Als globaler Anbieter stehen wir für ein außergewöhnlich breites Produktportfolio, das sich grundsätzlich in fünf Sparten unterteilt: DIAGNOSTIK Wir bieten eines der umfangreichsten Portfolios für präanalytische Prozesse an.",
        "s8": "Hierzu gehören  Produkte zur optimalen und sicheren Probenentnahme, für den Transport und die Lagerung diagnostischer Proben.",
        "s9": "Hierbei stellen wir unseren Kunden unterschiedliche Probenentnahmesysteme für die diversen Probenmaterialien Blut, Speichel, Urin oder Stuhl zur Verfügung.",
        "s10": "Kunden und Anwender unserer Produkte sind u.a. Kliniken, Arztpraxen, medizinische Labore und Blutbanken.",
        "s11": "LABOR Wir bieten maßgeschneiderte Produktlösungen für die verschiedenen Einsatzgebiete der Molekularbiologie, Biochemie, Zellbiologie und weiterer Bereiche.",
        "s12": "Eine stets auf die Anwendung angepasste Produktqualität ermöglicht dabei höchste Reproduzierbarkeit in der Analytik.",
        "s13": "Reinraumbedingungen und automatisierte Produktionsprozesse sind die Grundvoraussetzungen für die zertifizierten SARSTEDT-Qualitätsstandards „PCR Performance Tested“ und „Biosphere® plus\".",
        "s14": "Hierdurch können wir auch geringste Kontaminationen zuverlässig ausschließen und unseren Kunden dabei zu jeder Zeit die nötige Sicherheit in der Routine gewährleisten.",
        "s15": "Natürlich passen wir die Zertifizierungen dafür kontinuierlich dem aktuellen Forschungsstand an.",
        "s16": "KLINIK Die Schwerpunkte im Produktsegment der klinischen Versorgung bilden die Bereiche Regionalanästhesie und Urinableitungssysteme.",
        "s17": "Unser jahrzehntelanges Know-How in der Entwicklung und die Qualität der milliardenfachen Produktion von Blutentnahmekanülen wurden auf die Herstellung unserer Regionalanästhesie-Kanülen übertragen.",
        "s18": "Des Weiteren stellen wir zur patientengerechten Versorgung von Inkontinenz- bzw. Katheterpatienten Urinableitungssysteme inkl. Zubehör zur Verfügung, die entsprechend unseres eigenen Anspruchs eine sichere und hygienische Patientenbehandlung sicherstellen.",
        "s19": "TRANSFUSIONSMEDIZIN Bei uns hat Transfusionstechnologie System. Daher nutzen wir modernste Technik bei der Gewinnung, Verarbeitung und Anwendung von Blutkonserven.",
        "s20": "Wir bieten ein umfassendes Produktspektrum, damit wir unsere Kunden in den vielfältigen Bereichen der Transfusionsmedizin anwenderfreundlich, effizient und sicher unterstützen können.",
        "s21": "Bestes Beispiel ist unsere Blutmischwaage TOPSWING.",
        "s22": "Mit ihrer innovativen, dreidimensionalen Mischbewegung sichert die TOPSWING die Vermischung von Antikoagulanz und Blut.",
        "s23": "LABORAUTOMATION Bereits Mitte der 90er Jahre haben wir damit begonnen, Laborautomatisierungssysteme zu entwickeln. So haben wir unsere Kompetenz als Systemlösungsanbieter kontinuierlich ausgebaut und können unsere Kunden mit nunmehr jahrzehntelanger Erfahrung als Partner bei der Gestaltung von optimalen und effizienten Prozessen im Labor unterstützen.",
        "s24": "Im Vordergrund steht dabei, die Prozesse sicherer, präziser und wirtschaftlicher zu gestalten. Angeboten werden modulare Automatisierungslösungen für intelligentes Sortieren, Verteilen, Aliquotieren etc. bei prä- und postanalytischen Prozessen in klinischen und mikrobiologischen Bereichen."
      },
      "WholeText": "Wir entwickeln, produzieren und vertreiben Geräte und Verbrauchsmaterial für Medizin und Wissenschaft. Weltweit sind wir als einer der führenden Anbieter dieser Branche anerkannt. Breites Portfolio in Diagnostik, Labor, Medical, Transfusion und Laborautomation Unsere Produkte und Lösungen kommen in der medizinischen Versorgung und den unterschiedlichsten Laboren weltweit zum Einsatz. Hierzu zählt u.a. die Routine-Diagnostik im medizinischen Labor sowie die universitäre / industrielle Forschung und Analytik. Somit legen wir die Grundlage für eine exakte Diagnostik von Erkrankungen im Human- und Veterinärbereich. Darüber hinaus tragen unsere Materialien zur Forschung und Entwicklung neuer Medikamente und Verfahren zu einer weltweit verbesserten Gesundheitsversorgung bei. Als globaler Anbieter stehen wir für ein außergewöhnlich breites Produktportfolio, das sich grundsätzlich in fünf Sparten unterteilt: DIAGNOSTIK Wir bieten eines der umfangreichsten Portfolios für präanalytische Prozesse an. Hierzu gehören  Produkte zur optimalen und sicheren Probenentnahme, für den Transport und die Lagerung diagnostischer Proben.  Hierbei stellen wir unseren Kunden unterschiedliche Probenentnahmesysteme für die diversen Probenmaterialien Blut, Speichel, Urin oder Stuhl zur Verfügung. Kunden und Anwender unserer Produkte sind u.a. Kliniken, Arztpraxen, medizinische Labore und Blutbanken. LABOR Wir bieten maßgeschneiderte Produktlösungen für die verschiedenen Einsatzgebiete der Molekularbiologie, Biochemie, Zellbiologie und weiterer Bereiche. Eine stets auf die Anwendung angepasste Produktqualität ermöglicht dabei höchste Reproduzierbarkeit in der Analytik. Reinraumbedingungen und automatisierte Produktionsprozesse sind die Grundvoraussetzungen für die zertifizierten SARSTEDT-Qualitätsstandards „PCR Performance Tested“ und „Biosphere® plus\". Hierdurch können wir auch geringste Kontaminationen zuverlässig ausschließen und unseren Kunden dabei zu jeder Zeit die nötige Sicherheit in der Routine gewährleisten. Natürlich passen wir die Zertifizierungen dafür kontinuierlich dem aktuellen Forschungsstand an. KLINIK Die Schwerpunkte im Produktsegment der klinischen Versorgung bilden die Bereiche Regionalanästhesie und Urinableitungssysteme. Unser jahrzehntelanges Know-How in der Entwicklung und die Qualität der milliardenfachen Produktion von Blutentnahmekanülen wurden auf die Herstellung unserer Regionalanästhesie-Kanülen übertragen. Des Weiteren stellen wir zur patientengerechten Versorgung von Inkontinenz- bzw. Katheterpatienten Urinableitungssysteme inkl. Zubehör zur Verfügung, die entsprechend unseres eigenen Anspruchs eine sichere und hygienische Patientenbehandlung sicherstellen. TRANSFUSIONSMEDIZIN Bei uns hat Transfusionstechnologie System. Daher nutzen wir modernste Technik bei der Gewinnung, Verarbeitung und Anwendung von Blutkonserven. Wir bieten ein umfassendes Produktspektrum, damit wir unsere Kunden in den vielfältigen Bereichen der Transfusionsmedizin anwenderfreundlich, effizient und sicher unterstützen können. Bestes Beispiel ist unsere Blutmischwaage TOPSWING. Mit ihrer innovativen, dreidimensionalen Mischbewegung sichert die TOPSWING die Vermischung von Antikoagulanz und Blut. LABORAUTOMATION Bereits Mitte der 90er Jahre haben wir damit begonnen, Laborautomatisierungssysteme zu entwickeln. So haben wir unsere Kompetenz als Systemlösungsanbieter kontinuierlich ausgebaut und können unsere Kunden mit nunmehr jahrzehntelanger Erfahrung als Partner bei der Gestaltung von optimalen und effizienten Prozessen im Labor unterstützen. Im Vordergrund steht dabei, die Prozesse sicherer, präziser und wirtschaftlicher zu gestalten. Angeboten werden modulare Automatisierungslösungen für intelligentes Sortieren, Verteilen, Aliquotieren etc. bei prä- und postanalytischen Prozessen in klinischen und mikrobiologischen Bereichen."
    }
  },
  {
    "Company": {
      "key": "supplier-os-org-khg~4709",
      "name": "SCHÜTTE",
      "website": "https://fjschuette.de/de/unternehmen"
    },
    "AboutUs": {
      "Summary": "Mit dem Blick für die Zukunft und dem Bewusstsein für Entwicklung entstehen immer neue Arbeitsplätze, die die Visionen des Unternehmens widerspiegeln und fördern",
      "Paragraph": {
        "p1": "Wasser ist unser Ursprung. Unter dem Dach der SEE Holding produziert die Franz Joseph Schütte GmbH gemeinsam mit den Schwesterunternehmen KIRCHHOFF, EISL, EYCKHAUS und WASSERWERK hochwertige Armaturen, Brausen und Sanitärartikel. Vertrauen und Zufriedenheit sind die Basis für die Partnerschaft mit mehr als 150 Kundengruppen mit mehr als 6.500 Verkaufsstellen in Europa. Preis und Leistung stehen dabei in einem erstklassigen Verhältnis. Der moderne Standort in Wallenhorst bei Osnabrück umfasst mit über 60.000 qm die Verwaltung, Produktion und Logistik. Das inhabergeführte Unternehmen, mit fast 250 Mitarbeiterinnen und Mitarbeitern, steht für Qualität, Kompetenz und Service. Als verantwortungsvoller Arbeitgeber investiert Schütte in seine Angestellten und die Region. Mit dem Blick für die Zukunft und dem Bewusstsein für Entwicklung entstehen immer neue Arbeitsplätze, die die Visionen des Unternehmens widerspiegeln und fördern."
      },
      "Sentence": {
        "s1": "Wasser ist unser Ursprung.",
        "s2": "Unter dem Dach der SEE Holding produziert die Franz Joseph Schütte GmbH gemeinsam mit den Schwesterunternehmen KIRCHHOFF, EISL, EYCKHAUS und WASSERWERK hochwertige Armaturen, Brausen und Sanitärartikel.",
        "s3": "Vertrauen und Zufriedenheit sind die Basis für die Partnerschaft mit mehr als 150 Kundengruppen mit mehr als 6.500 Verkaufsstellen in Europa.",
        "s4": "Preis und Leistung stehen dabei in einem erstklassigen Verhältnis.",
        "s5": "Der moderne Standort in Wallenhorst bei Osnabrück umfasst mit über 60.000 qm die Verwaltung, Produktion und Logistik.",
        "s6": "Das inhabergeführte Unternehmen, mit fast 250 Mitarbeiterinnen und Mitarbeitern, steht für Qualität, Kompetenz und Service.",
        "s7": "Als verantwortungsvoller Arbeitgeber investiert Schütte in seine Angestellten und die Region.",
        "s8": "Mit dem Blick für die Zukunft und dem Bewusstsein für Entwicklung entstehen immer neue Arbeitsplätze, die die Visionen des Unternehmens widerspiegeln und fördern."
      },
      "WholeText": "Wasser ist unser Ursprung. Unter dem Dach der SEE Holding produziert die Franz Joseph Schütte GmbH gemeinsam mit den Schwesterunternehmen KIRCHHOFF, EISL, EYCKHAUS und WASSERWERK hochwertige Armaturen, Brausen und Sanitärartikel. Vertrauen und Zufriedenheit sind die Basis für die Partnerschaft mit mehr als 150 Kundengruppen mit mehr als 6.500 Verkaufsstellen in Europa. Preis und Leistung stehen dabei in einem erstklassigen Verhältnis. Der moderne Standort in Wallenhorst bei Osnabrück umfasst mit über 60.000 qm die Verwaltung, Produktion und Logistik. Das inhabergeführte Unternehmen, mit fast 250 Mitarbeiterinnen und Mitarbeitern, steht für Qualität, Kompetenz und Service. Als verantwortungsvoller Arbeitgeber investiert Schütte in seine Angestellten und die Region. Mit dem Blick für die Zukunft und dem Bewusstsein für Entwicklung entstehen immer neue Arbeitsplätze, die die Visionen des Unternehmens widerspiegeln und fördern."
    }
  },
  {
    "Company": {
      "key": "supplier-os-org-begros~9999943",
      "name": "grossmann",
      "website": "https://www.grossmann-leuchten.de/philosophie/"
    },
    "AboutUs": {
      "Summary": "Es sind vor allem zwei Dinge, die uns, unsere Unternehmensphilosophie und unseren Erfolg ausmachen: unser absolutes Bekenntnis zur Qualität unserer Produkte sowie zum Standort Deutschland und der Region Südwestfalen",
      "Paragraph": {
        "p1": "Wir konzipieren das Licht der Zukunft. Bereits in der dritten Generation realisieren wir außergewöhnliche Leuchtenkonzepte für Wohnräume, Hotels, Gastronomie, Büro- und Geschäftsräume, die einfach anders sind. Mit ihrer zeitlosen Ästhetik und der hochwertigen Verarbeitung überdauern sie die Zeit und stehen den kurzen Produktzyklen der schnelllebigen Konsumwelt diametral entgegen.",
        "p2": "Wir bekennen uns klar zur Qualität unserer Produkte und zum Standort Deutschland. Seit seiner Gründung 1968 hat sich GROSSMANN vom kleinen Anbieter für Beleuchtungszubehör zu einem international renommierten Hersteller von Wohnraumleuchten entwickelt. Es sind vor allem zwei Dinge, die uns, unsere Unternehmensphilosophie und unseren Erfolg ausmachen: unser absolutes Bekenntnis zur Qualität unserer Produkte sowie zum Standort Deutschland und der Region Südwestfalen. Darüber hinaus prägen ökologische und soziale Verantwortung unsere Unternehmensstrategie – heute stärker denn je. Wir planen, entwickeln und fertigen unsere Leuchten ausschließlich an unserem Firmensitz im nordrhein-westfälischen Ense. Dies erlaubt uns, die Produktionsprozesse eng zu begleiten und zu kontrollieren – und so eine gleichbleibend hohe Qualität zu gewährleisten. Die langfristige Zusammenarbeit mit regionalen Dienstleistern und Lieferanten liegt uns sehr am Herzen. Wir verbinden die Vorteile eines modernen Industrieunternehmens mit denen einer echten Manufaktur: So beschäftigen wir zum Beispiel einen gelernten Gürtler, der individuelle Prototypen und Kleinstmengen für unsere Geschäftskunden umsetzt. Doch nicht nur er, sondern alle unsere Mitarbeiterinnen und Mitarbeiter sind echte Experten in ihren jeweiligen Fachbereichen.",
        "p3": "Es ist nicht nur eine Leuchte. Es ist zeitlos gestaltetes Licht. Unsere Produkte sind mehr als nur Leuchten. Sie sind schmuckvolle Vehikel für Licht. Sie dienen nicht nur selbst als Blickfang, sondern zaubern wundervolle Lichteffekte in jeden Raum – mal strahlend hell wie eine Diva, mal raffiniert in Szene gesetzt und manchmal auch diffus zurückhaltend. Wir verstehen uns als Experten, die Leuchten und Licht zeitlos gestalten. Wir planen unsere Produkte so, dass sie mit ihrem Licht Stimmungen transportieren, eine besondere Atmosphäre erzeugen und Räume funktional genau dort erhellen, wo es benötigt wird."
      },
      "Sentence": {
        "s1": "Wir konzipieren das Licht der Zukunft.",
        "s2": "Bereits in der dritten Generation realisieren wir außergewöhnliche Leuchtenkonzepte für Wohnräume, Hotels, Gastronomie, Büro- und Geschäftsräume, die einfach anders sind.",
        "s3": "Mit ihrer zeitlosen Ästhetik und der hochwertigen Verarbeitung überdauern sie die Zeit und stehen den kurzen Produktzyklen der schnelllebigen Konsumwelt diametral entgegen.",
        "s4": "Wir bekennen uns klar zur Qualität unserer Produkte und zum Standort Deutschland.",
        "s5": "Seit seiner Gründung 1968 hat sich GROSSMANN vom kleinen Anbieter für Beleuchtungszubehör zu einem international renommierten Hersteller von Wohnraumleuchten entwickelt.",
        "s6": "Es sind vor allem zwei Dinge, die uns, unsere Unternehmensphilosophie und unseren Erfolg ausmachen: unser absolutes Bekenntnis zur Qualität unserer Produkte sowie zum Standort Deutschland und der Region Südwestfalen.",
        "s7": "Darüber hinaus prägen ökologische und soziale Verantwortung unsere Unternehmensstrategie – heute stärker denn je.",
        "s8": "Wir planen, entwickeln und fertigen unsere Leuchten ausschließlich an unserem Firmensitz im nordrhein-westfälischen Ense.",
        "s9": "Dies erlaubt uns, die Produktionsprozesse eng zu begleiten und zu kontrollieren – und so eine gleichbleibend hohe Qualität zu gewährleisten.",
        "s10": "Die langfristige Zusammenarbeit mit regionalen Dienstleistern und Lieferanten liegt uns sehr am Herzen.",
        "s11": "Wir verbinden die Vorteile eines modernen Industrieunternehmens mit denen einer echten Manufaktur: So beschäftigen wir zum Beispiel einen gelernten Gürtler, der individuelle Prototypen und Kleinstmengen für unsere Geschäftskunden umsetzt. Doch nicht nur er, sondern alle unsere Mitarbeiterinnen und Mitarbeiter sind echte Experten in ihren jeweiligen Fachbereichen.",
        "s12": "Es ist nicht nur eine Leuchte.",
        "s13": "Es ist zeitlos gestaltetes Licht.",
        "s14": "Unsere Produkte sind mehr als nur Leuchten.",
        "s15": "Sie sind schmuckvolle Vehikel für Licht.",
        "s16": "Sie dienen nicht nur selbst als Blickfang, sondern zaubern wundervolle Lichteffekte in jeden Raum – mal strahlend hell wie eine Diva, mal raffiniert in Szene gesetzt und manchmal auch diffus zurückhaltend.",
        "s17": "Wir verstehen uns als Experten, die Leuchten und Licht zeitlos gestalten.",
        "s18": "Wir planen unsere Produkte so, dass sie mit ihrem Licht Stimmungen transportieren, eine besondere Atmosphäre erzeugen und Räume funktional genau dort erhellen, wo es benötigt wird."
      },
      "WholeText": "Wir konzipieren das Licht der Zukunft. Bereits in der dritten Generation realisieren wir außergewöhnliche Leuchtenkonzepte für Wohnräume, Hotels, Gastronomie, Büro- und Geschäftsräume, die einfach anders sind. Mit ihrer zeitlosen Ästhetik und der hochwertigen Verarbeitung überdauern sie die Zeit und stehen den kurzen Produktzyklen der schnelllebigen Konsumwelt diametral entgegen. Wir bekennen uns klar zur Qualität unserer Produkte und zum Standort Deutschland. Seit seiner Gründung 1968 hat sich GROSSMANN vom kleinen Anbieter für Beleuchtungszubehör zu einem international renommierten Hersteller von Wohnraumleuchten entwickelt. Es sind vor allem zwei Dinge, die uns, unsere Unternehmensphilosophie und unseren Erfolg ausmachen: unser absolutes Bekenntnis zur Qualität unserer Produkte sowie zum Standort Deutschland und der Region Südwestfalen. Darüber hinaus prägen ökologische und soziale Verantwortung unsere Unternehmensstrategie – heute stärker denn je. Wir planen, entwickeln und fertigen unsere Leuchten ausschließlich an unserem Firmensitz im nordrhein-westfälischen Ense. Dies erlaubt uns, die Produktionsprozesse eng zu begleiten und zu kontrollieren – und so eine gleichbleibend hohe Qualität zu gewährleisten. Die langfristige Zusammenarbeit mit regionalen Dienstleistern und Lieferanten liegt uns sehr am Herzen. Wir verbinden die Vorteile eines modernen Industrieunternehmens mit denen einer echten Manufaktur: So beschäftigen wir zum Beispiel einen gelernten Gürtler, der individuelle Prototypen und Kleinstmengen für unsere Geschäftskunden umsetzt. Doch nicht nur er, sondern alle unsere Mitarbeiterinnen und Mitarbeiter sind echte Experten in ihren jeweiligen Fachbereichen. Es ist nicht nur eine Leuchte. Es ist zeitlos gestaltetes Licht. Unsere Produkte sind mehr als nur Leuchten. Sie sind schmuckvolle Vehikel für Licht. Sie dienen nicht nur selbst als Blickfang, sondern zaubern wundervolle Lichteffekte in jeden Raum – mal strahlend hell wie eine Diva, mal raffiniert in Szene gesetzt und manchmal auch diffus zurückhaltend. Wir verstehen uns als Experten, die Leuchten und Licht zeitlos gestalten. Wir planen unsere Produkte so, dass sie mit ihrem Licht Stimmungen transportieren, eine besondere Atmosphäre erzeugen und Räume funktional genau dort erhellen, wo es benötigt wird."
    }
  },
  {
    "Company": {
      "key": "supplier-os-org-hagebau2~975600",
      "name": "gausmann",
      "website": "https://www.gausmann.com/ueber-uns/"
    },
    "AboutUs": {
      "Summary": "Gausmann verkörpert familiäre Werte, Know-how, Erfahrung und Langlebigkeit – und das spiegelt sich auch in den Produkten wider",
      "Paragraph": {
        "p1": "1947 ist das von Ernst Gausmann gegründete Unternehmen ein Bergbauzulieferer. Nur drei Jahre später wird das Portfolio erweitert und Gausmann vertreibt erstmals Absperrpfosten, Wegsperren und Schranken. 1968 übernimmt Ernst Bernd Gausmann die Führung. Mittlerweile sind auch Batterien im Sortiment zu finden – vor allem für den Großhandel. In den 1980er-Jahren folgen dann die Elektroschranken. Durch sie kommen neue Dienstleistungen hinzu – wie die Planung, der Aufbau und die Wartung der Schranken.",
        "p2": "Das Unternehmen wächst, baut das eigene Portfolio weiter aus und profitiert von seiner jahrelangen Erfahrung. Gausmann wird unter anderem zum Master-Distributor für Procell-Batterien und zum zertifizierten Fachpartner für „Magnetic Autocontrol“-Schranken. Auf das Unternehmen ist Verlass.",
        "p3": "Gausmann verkörpert familiäre Werte, Know-how, Erfahrung und Langlebigkeit – und das spiegelt sich auch in den Produkten wider."
      },
      "Sentence": {
        "s1": "1947 ist das von Ernst Gausmann gegründete Unternehmen ein Bergbauzulieferer.",
        "s2": "Nur drei Jahre später wird das Portfolio erweitert und Gausmann vertreibt erstmals Absperrpfosten, Wegsperren und Schranken.",
        "s3": "1968 übernimmt Ernst Bernd Gausmann die Führung.",
        "s4": "Mittlerweile sind auch Batterien im Sortiment zu finden – vor allem für den Großhandel.",
        "s5": "In den 1980er-Jahren folgen dann die Elektroschranken.",
        "s6": "Durch sie kommen neue Dienstleistungen hinzu – wie die Planung, der Aufbau und die Wartung der Schranken.",
        "s7": "Das Unternehmen wächst, baut das eigene Portfolio weiter aus und profitiert von seiner jahrelangen Erfahrung.",
        "s8": "Gausmann wird unter anderem zum Master-Distributor für Procell-Batterien und zum zertifizierten Fachpartner für „Magnetic Autocontrol“-Schranken.",
        "s9": "Auf das Unternehmen ist Verlass.",
        "s10": "Gausmann verkörpert familiäre Werte, Know-how, Erfahrung und Langlebigkeit – und das spiegelt sich auch in den Produkten wider."
      },
      "WholeText": "1947 ist das von Ernst Gausmann gegründete Unternehmen ein Bergbauzulieferer. Nur drei Jahre später wird das Portfolio erweitert und Gausmann vertreibt erstmals Absperrpfosten, Wegsperren und Schranken. 1968 übernimmt Ernst Bernd Gausmann die Führung. Mittlerweile sind auch Batterien im Sortiment zu finden – vor allem für den Großhandel. In den 1980er-Jahren folgen dann die Elektroschranken. Durch sie kommen neue Dienstleistungen hinzu – wie die Planung, der Aufbau und die Wartung der Schranken. Das Unternehmen wächst, baut das eigene Portfolio weiter aus und profitiert von seiner jahrelangen Erfahrung. Gausmann wird unter anderem zum Master-Distributor für Procell-Batterien und zum zertifizierten Fachpartner für „Magnetic Autocontrol“-Schranken. Auf das Unternehmen ist Verlass. Gausmann verkörpert familiäre Werte, Know-how, Erfahrung und Langlebigkeit – und das spiegelt sich auch in den Produkten wider."
    }
  },
  {
    "Company": {
      "key": "supplier-os-org-begros~9900849",
      "name": "Indes Fuggerhaus",
      "website": "https://www.indesfuggerhaus.de/unternehmen/philosophie/?L=0"
    },
    "AboutUs": {
      "Summary": "Ununterbrochene Trendrecherchen sowie der Austausch und Ideensammlung mit unseren Kunden und Mitarbeitern sind für die Entwicklung unserer Kollektionen ausschlaggebend – hier lassen wir unserer Kreativität freien Lauf",
      "Paragraph": {
        "p1": "Unsere Philosophie Wohnstoffe für Gardinen, Vorhänge und Polstermöbel. Diese Produkte stehen bei Indes Fuggerhaus im Mittelpunkt. Als internationaler Textilverlag haben wir es uns zur Aufgabe gemacht unser gesamtes Können und unsere Leidenschaft der Entwicklung und Gestaltung idealer Kollektionen zu widmen. Wir sind ständig in Bewegung und stehen Veränderungen offen und positiv gegenüber. In den letzten Jahren ist unser Team gewachsen - vor allem der Zusammenhalt. Gemeinsam setzen wir Ideen in Projekte um – hierbei konzentrieren wir uns immer auf den Menschen und die Stoffe mit denen er sich umgibt. Unser Team hat es sich zur Aufgabe gemacht, durch hohe Kreativität und erstklassigen Kundenservice zu den Besten der Branche zu gehören. Dabei legen wir großen Wert auf eine gute Beziehung zu unseren Kunden und Lieferanten.",
        "p2": "kreativ Trends erfassen und diese ideal auf Heimtextilien umsetzen – das ist unsere Leidenschaft! Ununterbrochene Trendrecherchen sowie der Austausch und Ideensammlung mit unseren Kunden und Mitarbeitern sind für die Entwicklung unserer Kollektionen ausschlaggebend – hier lassen wir unserer Kreativität freien Lauf. Durch enge Zusammenarbeit untereinander entstehen in kreativer Atmosphäre Stoffe hinter denen viele Geschichten stecken. Wir greifen aktuelle Trends auf und setzen diese auf Heimtextilien um – so dass unterschiedlichste Einrichtungsstile mit unseren Wohnstoffen perfekt harmonieren."
      },
      "Sentence": {
        "s1": "Unsere Philosophie Wohnstoffe für Gardinen, Vorhänge und Polstermöbel",
        "s2": "Diese Produkte stehen bei Indes Fuggerhaus im Mittelpunkt",
        "s3": "Als internationaler Textilverlag haben wir es uns zur Aufgabe gemacht unser gesamtes Können und unsere Leidenschaft der Entwicklung und Gestaltung idealer Kollektionen zu widmen",
        "s4": "Wir sind ständig in Bewegung und stehen Veränderungen offen und positiv gegenüber",
        "s5": "In den letzten Jahren ist unser Team gewachsen - vor allem der Zusammenhalt",
        "s6": "Gemeinsam setzen wir Ideen in Projekte um – hierbei konzentrieren wir uns immer auf den Menschen und die Stoffe mit denen er sich umgibt",
        "s7": "Unser Team hat es sich zur Aufgabe gemacht, durch hohe Kreativität und erstklassigen Kundenservice zu den Besten der Branche zu gehören",
        "s8": "Dabei legen wir großen Wert auf eine gute Beziehung zu unseren Kunden und Lieferanten",
        "s9": "kreativ Trends erfassen und diese ideal auf Heimtextilien umsetzen – das ist unsere Leidenschaft! Ununterbrochene Trendrecherchen sowie der Austausch und Ideensammlung mit unseren Kunden und Mitarbeitern sind für die Entwicklung unserer Kollektionen ausschlaggebend – hier lassen wir unserer Kreativität freien Lauf",
        "s10": "Durch enge Zusammenarbeit untereinander entstehen in kreativer Atmosphäre Stoffe hinter denen viele Geschichten stecken",
        "s11": "Wir greifen aktuelle Trends auf und setzen diese auf Heimtextilien um – so dass unterschiedlichste Einrichtungsstile mit unseren Wohnstoffen perfekt harmonieren"
      },
      "WholeText": "Unsere Philosophie Wohnstoffe für Gardinen, Vorhänge und Polstermöbel. Diese Produkte stehen bei Indes Fuggerhaus im Mittelpunkt. Als internationaler Textilverlag haben wir es uns zur Aufgabe gemacht unser gesamtes Können und unsere Leidenschaft der Entwicklung und Gestaltung idealer Kollektionen zu widmen. Wir sind ständig in Bewegung und stehen Veränderungen offen und positiv gegenüber. In den letzten Jahren ist unser Team gewachsen - vor allem der Zusammenhalt. Gemeinsam setzen wir Ideen in Projekte um – hierbei konzentrieren wir uns immer auf den Menschen und die Stoffe mit denen er sich umgibt. Unser Team hat es sich zur Aufgabe gemacht, durch hohe Kreativität und erstklassigen Kundenservice zu den Besten der Branche zu gehören. Dabei legen wir großen Wert auf eine gute Beziehung zu unseren Kunden und Lieferanten. kreativ Trends erfassen und diese ideal auf Heimtextilien umsetzen – das ist unsere Leidenschaft! Ununterbrochene Trendrecherchen sowie der Austausch und Ideensammlung mit unseren Kunden und Mitarbeitern sind für die Entwicklung unserer Kollektionen ausschlaggebend – hier lassen wir unserer Kreativität freien Lauf. Durch enge Zusammenarbeit untereinander entstehen in kreativer Atmosphäre Stoffe hinter denen viele Geschichten stecken. Wir greifen aktuelle Trends auf und setzen diese auf Heimtextilien um – so dass unterschiedlichste Einrichtungsstile mit unseren Wohnstoffen perfekt harmonieren."
    }
  },
  {
    "Company": {
      "key": "supplier-os-org-bezirksklinikenmfr~9004939",
      "name": "pillenstein",
      "website": "https://www.pillenstein.de/unternehmen/"
    },
    "AboutUs": {
      "Summary": "AUTOHAUS PILLENSTEIN IN FÜRTH UND NEUSTADT Das Stammhaus des Autohaus Pillenstein an der Stadtgrenze Nürnberg/Fürth bietet Ihnen alle Leistungen eines modernen Autohauses von Neuwagen über Gebrauchtwagen bis hin zu individuellen Finanzierungs- und Versicherungsleistungen",
      "Paragraph": {
        "p1": "AUTOHAUS PILLENSTEIN – IHR PARTNER FÜR MOBILITÄT Wir, das Autohaus Pillenstein, sind eines der führenden Volkswagen Autohäuser Deutschlands. Knapp 250 Mitarbeiter kümmern sich im Volkswagen Zentrum Pillenstein in Fürth und im Autohaus Pillenstein Neustadt um Ihre Mobilität. Egal ob Neu- oder Gebrauchtwagen für den privaten Fahrspaß, Nutzfahrzeuge für spezielle Anforderungen oder ein Mietwagen aus unserer Petra Autovermietung: Wir haben garantiert das passende Fahrzeug für Sie. Wir bieten Ihnen die komplette Modellpalette von Volkswagen und Volkswagen Nutzfahrzeuge, sowie eine attraktive Auswahl an Gebrauchtfahrzeugen für Ihre individuellen Wünsche. Zusätzlich vermitteln wir Ihnen Neuwagen von Audi uns Skoda. Überzeugen Sie sich auch von unserem umfassenden Service-Angebot und freuen Sie sich auf Ihr Autohaus Pillenstein, bei dem Sie als Kunde stets im Mittelpunkt stehen.",
        "p2": "AUTOHAUS PILLENSTEIN – UNSER SERVICEVERSPRECHEN Perfekte Dienstleistung rund um Ihre Mobilität ist das oberstes Ziel im Autohaus Pillenstein. Nicht umsonst sind wir in Sachen Kundenzufriedenheit bei Audi und Volkswagen regelmäßig auf den vorderen Plätzen zu finden. Bereits zum vierten Mal in den letzten fünf Jahren dürfen wir uns zu den VW Händlern des Jahres und damit zu den 50 Besten Volkswagen Betrieben in Deutschland zählen. Und das zeigen wir Ihnen auch: Bei uns erhalten Sie den kompletten Service für Ihren Volkswagen, Volkswagen Nutzfahrzeuge, Audi oder Skoda aus einer Hand. Ob regelmäßiger Kundendienst, eine kleine Delle, ein Kratzer oder eine komplette Unfallinstandsetzung – das kompetente Service-Team im Autohaus Pillenstein Fürth und Autohaus Pillenstein Neustadt hilft Ihnen gerne weiter. Bei größeren Reparaturen halten wir Sie mobil mit den günstigen Werkstattersatztarifen unserer hauseigenen Petra Autovermietung. Mit Pillenstein sind Sie immer gut in Fahrt – das ist unsere Mobilitätsgarantie!",
        "p3": "AUTOHAUS PILLENSTEIN IN FÜRTH UND NEUSTADT Das Stammhaus des Autohaus Pillenstein an der Stadtgrenze Nürnberg/Fürth bietet Ihnen alle Leistungen eines modernen Autohauses von Neuwagen über Gebrauchtwagen bis hin zu individuellen Finanzierungs- und Versicherungsleistungen. In unseren Schauräumen können Sie die komplette Volkswagen Modell-Palette „live“ bewundern. Unsere moderne Werkstatt bietet Ihnen zudem kompetenten Service für Volkswagen, Volkswagen Nutzfahrzeuge, Audi oder Skoda. Ob Neu- oder Gebrauchtwagen, Nutzfahrzeug oder Autovermietung, wir halten Sie mobil. Das Autohaus Pillenstein – auch im Neustädter Landkreis Ihr kompetenter Partner. Unsere Filiale in Neustadt/Aisch bietet Ihnen ein umfangreiches Volkswagen-Angebot aus Neuwagen, Jahreswagen, Gebrauchtwagen und Mietwagen. Zudem verfügt es über eine moderne Werkstatt und versorgt Sie bei Bedarf mit allen Ersatzteilen und der ganze Bandbreite des Volkswagen-Zubehörs für alle VW- und Audi-Modelle. Das Autohaus wurde bereits 1950 gegründet und blickt auf eine lange, erfolgreiche Geschichte zurück. Diese Erfahrung, gepaart mit der hohen Fachkompetenz der Mitarbeiter macht das Autohaus Pillenstein Neustadt zu Ihrem VW Händler in Neustadt und Umgebung. Wir freuen uns auf Ihren Besuch!"
      },
      "Sentence": {
        "s1": "AUTOHAUS PILLENSTEIN – IHR PARTNER FÜR MOBILITÄT Wir, das Autohaus Pillenstein, sind eines der führenden Volkswagen Autohäuser Deutschlands",
        "s2": "Knapp 250 Mitarbeiter kümmern sich im Volkswagen Zentrum Pillenstein in Fürth und im Autohaus Pillenstein Neustadt um Ihre Mobilität",
        "s3": "Egal ob Neu- oder Gebrauchtwagen für den privaten Fahrspaß, Nutzfahrzeuge für spezielle Anforderungen oder ein Mietwagen aus unserer Petra Autovermietung: Wir haben garantiert das passende Fahrzeug für Sie",
        "s4": "Wir bieten Ihnen die komplette Modellpalette von Volkswagen und Volkswagen Nutzfahrzeuge, sowie eine attraktive Auswahl an Gebrauchtfahrzeugen für Ihre individuellen Wünsche",
        "s5": "Zusätzlich vermitteln wir Ihnen Neuwagen von Audi uns Skoda",
        "s6": "Überzeugen Sie sich auch von unserem umfassenden Service-Angebot und freuen Sie sich auf Ihr Autohaus Pillenstein, bei dem Sie als Kunde stets im Mittelpunkt stehen",
        "s7": "Nicht umsonst sind wir in Sachen Kundenzufriedenheit bei Audi und Volkswagen regelmäßig auf den vorderen Plätzen zu finden",
        "s8": "Bereits zum vierten Mal in den letzten fünf Jahren dürfen wir uns zu den VW Händlern des Jahres und damit zu den 50 Besten Volkswagen Betrieben in Deutschland zählen",
        "s9": "Und das zeigen wir Ihnen auch: Bei uns erhalten Sie den kompletten Service für Ihren Volkswagen, Volkswagen Nutzfahrzeuge, Audi oder Skoda aus einer Hand",
        "s10": "Ob regelmäßiger Kundendienst, eine kleine Delle, ein Kratzer oder eine komplette Unfallinstandsetzung – das kompetente Service-Team im Autohaus Pillenstein Fürth und Autohaus Pillenstein Neustadt hilft Ihnen gerne weiter",
        "s11": "Bei größeren Reparaturen halten wir Sie mobil mit den günstigen Werkstattersatztarifen unserer hauseigenen Petra Autovermietung",
        "s12": "Mit Pillenstein sind Sie immer gut in Fahrt – das ist unsere Mobilitätsgarantie! AUTOHAUS PILLENSTEIN IN FÜRTH UND NEUSTADT Das Stammhaus des Autohaus Pillenstein an der Stadtgrenze Nürnberg/Fürth bietet Ihnen alle Leistungen eines modernen Autohauses von Neuwagen über Gebrauchtwagen bis hin zu individuellen Finanzierungs- und Versicherungsleistungen",
        "s13": "In unseren Schauräumen können Sie die komplette Volkswagen Modell-Palette „live“ bewundern",
        "s14": "Unsere moderne Werkstatt bietet Ihnen zudem kompetenten Service für Volkswagen, Volkswagen Nutzfahrzeuge, Audi oder Skoda",
        "s15": "Ob Neu- oder Gebrauchtwagen, Nutzfahrzeug oder Autovermietung, wir halten Sie mobil",
        "s16": "Das Autohaus Pillenstein – auch im Neustädter Landkreis Ihr kompetenter Partner",
        "s17": "Unsere Filiale in Neustadt/Aisch bietet Ihnen ein umfangreiches Volkswagen-Angebot aus Neuwagen, Jahreswagen, Gebrauchtwagen und Mietwagen",
        "s18": "Zudem verfügt es über eine moderne Werkstatt und versorgt Sie bei Bedarf mit allen Ersatzteilen und der ganze Bandbreite des Volkswagen-Zubehörs für alle VW- und Audi-Modelle",
        "s19": "Das Autohaus wurde bereits 1950 gegründet und blickt auf eine lange, erfolgreiche Geschichte zurück",
        "s20": "Diese Erfahrung, gepaart mit der hohen Fachkompetenz der Mitarbeiter macht das Autohaus Pillenstein Neustadt zu Ihrem VW Händler in Neustadt und Umgebung",
        "s21": "Wir freuen uns auf Ihren Besuch!"
      },
      "WholeText": "AUTOHAUS PILLENSTEIN – IHR PARTNER FÜR MOBILITÄT Wir, das Autohaus Pillenstein, sind eines der führenden Volkswagen Autohäuser Deutschlands. Knapp 250 Mitarbeiter kümmern sich im Volkswagen Zentrum Pillenstein in Fürth und im Autohaus Pillenstein Neustadt um Ihre Mobilität. Egal ob Neu- oder Gebrauchtwagen für den privaten Fahrspaß, Nutzfahrzeuge für spezielle Anforderungen oder ein Mietwagen aus unserer Petra Autovermietung: Wir haben garantiert das passende Fahrzeug für Sie. Wir bieten Ihnen die komplette Modellpalette von Volkswagen und Volkswagen Nutzfahrzeuge, sowie eine attraktive Auswahl an Gebrauchtfahrzeugen für Ihre individuellen Wünsche. Zusätzlich vermitteln wir Ihnen Neuwagen von Audi uns Skoda. Überzeugen Sie sich auch von unserem umfassenden Service-Angebot und freuen Sie sich auf Ihr Autohaus Pillenstein, bei dem Sie als Kunde stets im Mittelpunkt stehen. AUTOHAUS PILLENSTEIN – UNSER SERVICEVERSPRECHEN Perfekte Dienstleistung rund um Ihre Mobilität ist das oberstes Ziel im Autohaus Pillenstein. Nicht umsonst sind wir in Sachen Kundenzufriedenheit bei Audi und Volkswagen regelmäßig auf den vorderen Plätzen zu finden. Bereits zum vierten Mal in den letzten fünf Jahren dürfen wir uns zu den VW Händlern des Jahres und damit zu den 50 Besten Volkswagen Betrieben in Deutschland zählen. Und das zeigen wir Ihnen auch: Bei uns erhalten Sie den kompletten Service für Ihren Volkswagen, Volkswagen Nutzfahrzeuge, Audi oder Skoda aus einer Hand. Ob regelmäßiger Kundendienst, eine kleine Delle, ein Kratzer oder eine komplette Unfallinstandsetzung – das kompetente Service-Team im Autohaus Pillenstein Fürth und Autohaus Pillenstein Neustadt hilft Ihnen gerne weiter. Bei größeren Reparaturen halten wir Sie mobil mit den günstigen Werkstattersatztarifen unserer hauseigenen Petra Autovermietung. Mit Pillenstein sind Sie immer gut in Fahrt – das ist unsere Mobilitätsgarantie! AUTOHAUS PILLENSTEIN IN FÜRTH UND NEUSTADT Das Stammhaus des Autohaus Pillenstein an der Stadtgrenze Nürnberg/Fürth bietet Ihnen alle Leistungen eines modernen Autohauses von Neuwagen über Gebrauchtwagen bis hin zu individuellen Finanzierungs- und Versicherungsleistungen. In unseren Schauräumen können Sie die komplette Volkswagen Modell-Palette „live“ bewundern. Unsere moderne Werkstatt bietet Ihnen zudem kompetenten Service für Volkswagen, Volkswagen Nutzfahrzeuge, Audi oder Skoda. Ob Neu- oder Gebrauchtwagen, Nutzfahrzeug oder Autovermietung, wir halten Sie mobil. Das Autohaus Pillenstein – auch im Neustädter Landkreis Ihr kompetenter Partner. Unsere Filiale in Neustadt/Aisch bietet Ihnen ein umfangreiches Volkswagen-Angebot aus Neuwagen, Jahreswagen, Gebrauchtwagen und Mietwagen. Zudem verfügt es über eine moderne Werkstatt und versorgt Sie bei Bedarf mit allen Ersatzteilen und der ganze Bandbreite des Volkswagen-Zubehörs für alle VW- und Audi-Modelle. Das Autohaus wurde bereits 1950 gegründet und blickt auf eine lange, erfolgreiche Geschichte zurück. Diese Erfahrung, gepaart mit der hohen Fachkompetenz der Mitarbeiter macht das Autohaus Pillenstein Neustadt zu Ihrem VW Händler in Neustadt und Umgebung. Wir freuen uns auf Ihren Besuch!"
    }
  },
  {
    "Company": {
      "key": "supplier-os-org-ukmuenster~20006277",
      "name": "doemer-metallbau",
      "website": "https://www.doemer-metallbau.de/UeBER-UNS/"
    },
    "AboutUs": {
      "Summary": "1933 wurde der Schmiedemeister Felix Dömer in die Handwerksrolle eingetragen und verdient sein Geld mit den Reparaturen von Landmaschinen sowie als Huf- und Wagenschmied",
      "Paragraph": {
        "p1": "1933 wurde der Schmiedemeister Felix Dömer in die Handwerksrolle eingetragen und verdient sein Geld mit den Reparaturen von Landmaschinen sowie als Huf- und Wagenschmied. In den 60er Jahren wurde aus dieser Schmiede eine Bauschlosserei und ab 1960 wurden dort Aluminiumfenster und -Türen gefertigt. Der Einstig in den Metallbau war gelungen. 1968 verstarb der Firmengründer Felix Dömer und sein Sohn Leo Dömer übernahm die Geschäftsführung. 1974 zog Dömer Metallbau in das neue Industriegebiet \"Westring\" und konnte sich dort vergrößern.",
        "p2": "Im Jahr 2002 übernahm Lothar Dömer, als Inhaber und geschäftsführender Gesellschafter in der 3. Generation, das Familienunternehmen. Noch heute setzt die Dömer Metallbau GmbH ihre Aufwärtsentwicklung fort. Gemäß dem Motto \"Stillstand ist Rückschritt\" passt sich das Unternehmen an Veränderungen am Markt kontinuierlich an. Und auch nach 85 Jahren erweist sich die Unternehmensphilosophie noch als erfolgreich: Langfristige Zusammenarbeit und vertrauensvolle Partnerschaft zu den Kunden und Lieferanten!"
      },
      "Sentence": {
        "s1": "1933 wurde der Schmiedemeister Felix Dömer in die Handwerksrolle eingetragen und verdient sein Geld mit den Reparaturen von Landmaschinen sowie als Huf- und Wagenschmied.",
        "s2": "In den 60er Jahren wurde aus dieser Schmiede eine Bauschlosserei und ab 1960 wurden dort Aluminiumfenster und -Türen gefertigt.",
        "s3": "Der Einstig in den Metallbau war gelungen.",
        "s4": "1968 verstarb der Firmengründer Felix Dömer und sein Sohn Leo Dömer übernahm die Geschäftsführung.",
        "s5": "1974 zog Dömer Metallbau in das neue Industriegebiet \"Westring\" und konnte sich dort vergrößern.",
        "s6": "Im Jahr 2002 übernahm Lothar Dömer, als Inhaber und geschäftsführender Gesellschafter in der 3. Generation, das Familienunternehmen.",
        "s7": "Noch heute setzt die Dömer Metallbau GmbH ihre Aufwärtsentwicklung fort.",
        "s8": "Gemäß dem Motto \"Stillstand ist Rückschritt\" passt sich das Unternehmen an Veränderungen am Markt kontinuierlich an.",
        "s9": "Und auch nach 85 Jahren erweist sich die Unternehmensphilosophie noch als erfolgreich: Langfristige Zusammenarbeit und vertrauensvolle Partnerschaft zu den Kunden und Lieferanten!"
      },
      "WholeText": "1933 wurde der Schmiedemeister Felix Dömer in die Handwerksrolle eingetragen und verdient sein Geld mit den Reparaturen von Landmaschinen sowie als Huf- und Wagenschmied. In den 60er Jahren wurde aus dieser Schmiede eine Bauschlosserei und ab 1960 wurden dort Aluminiumfenster und -Türen gefertigt. Der Einstig in den Metallbau war gelungen. 1968 verstarb der Firmengründer Felix Dömer und sein Sohn Leo Dömer übernahm die Geschäftsführung. 1974 zog Dömer Metallbau in das neue Industriegebiet \"Westring\" und konnte sich dort vergrößern. Im Jahr 2002 übernahm Lothar Dömer, als Inhaber und geschäftsführender Gesellschafter in der 3. Generation, das Familienunternehmen. Noch heute setzt die Dömer Metallbau GmbH ihre Aufwärtsentwicklung fort. Gemäß dem Motto \"Stillstand ist Rückschritt\" passt sich das Unternehmen an Veränderungen am Markt kontinuierlich an. Und auch nach 85 Jahren erweist sich die Unternehmensphilosophie noch als erfolgreich: Langfristige Zusammenarbeit und vertrauensvolle Partnerschaft zu den Kunden und Lieferanten!"
    }
  },
  {
    "Company": {
      "key": "supplier-os-org-ukmuenster~20008801",
      "name": "Schauf",
      "website": "https://schauf.eu/ueber-uns/"
    },
    "AboutUs": {
      "Summary": "Sportanzeigen Technologisch auf dem neuesten Stand und mit höchster Präzision gefertigt – unsere Sportanzeigen eignen sich für viele Sportarten und orientieren sich an den jeweiligen Richtlinien der Sportverbände",
      "Paragraph": {
        "p1": "Das Vertrauen und die Zufriedenheit unserer Kunden hat für uns oberste Priorität. Wir begleiten Sie von der Beratung und Planung über Projektierung und Projektleitung bis zur Realisierung und erfolgreicher Inbetriebnahme. Unsere 40-jährige Erfahrung sichert Ihnen Kompetenz und Qualität in den Bereichen Industrie, Sport sowie Zeitsysteme.",
        "p2": "Als einer der führenden Hersteller von Leit- und Anzeigensystemen entwickeln wir Komplettlösungen unter einem Dach. Ob Software oder Hardware – unsere innovativen Lösungen basieren auf dem neuesten Stand der Technik. An unserem Standort in Langenfeld produzieren und entwickeln wir sowohl branchenspezifische Standardlösungen als auch individuell angepasste Lösungen zur Optimierung Ihrer Prozesse – zertifiziert nach DIN EN ISO 9001:2015. Für den besonderen Service stehen Ihnen unser eigener Kundendienst, individuelle Wartungsverträge sowie Miet- und Finanzierungsmodelle zur Verfügung.",
        "p3": "Zeitsysteme Uhren sind die zuverlässigste Möglichkeit, die Tageszeit korrekt und einheitlich anzuzeigen. Neben kompletten Uhrensystemen finden auch viele einzelne, autark laufende Uhren ihren Platz in unserem Zeit Portfolio.",
        "p4": "Sportanzeigen Technologisch auf dem neuesten Stand und mit höchster Präzision gefertigt – unsere Sportanzeigen eignen sich für viele Sportarten und orientieren sich an den jeweiligen Richtlinien der Sportverbände. Halten Sie mit unseren Zeitsystemen die richtige Uhrzeit im Bl",
        "p5": "Industrieanzeigen Vielseitig einsetzbar sorgt die klare Darstellung und hohe Bandbreite an Zeichenhöhen unserer Industrieanzeigen für die optimale Lesbarkeit – auch aus großen Entfernungen."
      },
      "Sentence": {
        "s1": "Das Vertrauen und die Zufriedenheit unserer Kunden hat für uns oberste Priorität",
        "s2": "Wir begleiten Sie von der Beratung und Planung über Projektierung und Projektleitung bis zur Realisierung und erfolgreicher Inbetriebnahme",
        "s3": "Unsere 40-jährige Erfahrung sichert Ihnen Kompetenz und Qualität in den Bereichen Industrie, Sport sowie Zeitsysteme",
        "s4": "Als einer der führenden Hersteller von Leit- und Anzeigensystemen entwickeln wir Komplettlösungen unter einem Dach",
        "s5": "Ob Software oder Hardware – unsere innovativen Lösungen basieren auf dem neuesten Stand der Technik",
        "s6": "An unserem Standort in Langenfeld produzieren und entwickeln wir sowohl branchenspezifische Standardlösungen als auch individuell angepasste Lösungen zur Optimierung Ihrer Prozesse – zertifiziert nach DIN EN ISO 9001:2015",
        "s7": "Für den besonderen Service stehen Ihnen unser eigener Kundendienst, individuelle Wartungsverträge sowie Miet- und Finanzierungsmodelle zur Verfügung",
        "s8": "Zeitsysteme Uhren sind die zuverlässigste Möglichkeit, die Tageszeit korrekt und einheitlich anzuzeigen",
        "s9": "Neben kompletten Uhrensystemen finden auch viele einzelne, autark laufende Uhren ihren Platz in unserem Zeit Portfolio",
        "s10": "Industrieanzeigen Vielseitig einsetzbar sorgt die klare Darstellung und hohe Bandbreite an Zeichenhöhen unserer Industrieanzeigen für die optimale Lesbarkeit – auch aus großen Entfernungen",
        "s11": "Sportanzeigen Technologisch auf dem neuesten Stand und mit höchster Präzision gefertigt – unsere Sportanzeigen eignen sich für viele Sportarten und orientieren sich an den jeweiligen Richtlinien der Sportverbände",
        "s12": "Halten Sie mit unseren Zeitsystemen die richtige Uhrzeit im Bl"
      },
      "WholeText": "Das Vertrauen und die Zufriedenheit unserer Kunden hat für uns oberste Priorität. Wir begleiten Sie von der Beratung und Planung über Projektierung und Projektleitung bis zur Realisierung und erfolgreicher Inbetriebnahme. Unsere 40-jährige Erfahrung sichert Ihnen Kompetenz und Qualität in den Bereichen Industrie, Sport sowie Zeitsysteme. Als einer der führenden Hersteller von Leit- und Anzeigensystemen entwickeln wir Komplettlösungen unter einem Dach. Ob Software oder Hardware – unsere innovativen Lösungen basieren auf dem neuesten Stand der Technik. An unserem Standort in Langenfeld produzieren und entwickeln wir sowohl branchenspezifische Standardlösungen als auch individuell angepasste Lösungen zur Optimierung Ihrer Prozesse – zertifiziert nach DIN EN ISO 9001:2015. Für den besonderen Service stehen Ihnen unser eigener Kundendienst, individuelle Wartungsverträge sowie Miet- und Finanzierungsmodelle zur Verfügung. Zeitsysteme Uhren sind die zuverlässigste Möglichkeit, die Tageszeit korrekt und einheitlich anzuzeigen. Neben kompletten Uhrensystemen finden auch viele einzelne, autark laufende Uhren ihren Platz in unserem Zeit Portfolio. Sportanzeigen Technologisch auf dem neuesten Stand und mit höchster Präzision gefertigt – unsere Sportanzeigen eignen sich für viele Sportarten und orientieren sich an den jeweiligen Richtlinien der Sportverbände. Halten Sie mit unseren Zeitsystemen die richtige Uhrzeit im Bl Industrieanzeigen Vielseitig einsetzbar sorgt die klare Darstellung und hohe Bandbreite an Zeichenhöhen unserer Industrieanzeigen für die optimale Lesbarkeit – auch aus großen Entfernungen."
    }
  },
  {
    "Company": {
      "key": "supplier-os-org-ukmuenster~20012059",
      "name": "ZOLL",
      "website": "https://www.zoll.com/de/profil/unternehmen"
    },
    "AboutUs": {
      "Summary": "Mit Produkten in den Bereichen Defibrillation und kardiale Überwachung, Kreislaufverbesserung und Feedback zur Wiederbelebung, SuperSaturated-Oxygen-Therapie, Datenmanagement, Beatmung, therapeutisches Temperaturmanagement und Diagnose sowie Behandlung von Schlafapnoe bietet ZOLL ein umfassendes Angebot an Technologien, die Klinikpersonal, den Rettungsdienst und Feuerwehrleute sowie Ersthelfer bei besseren Patientenergebnissen in kardiopulmonalen Notfällen unterstützen",
      "Paragraph": {
        "p1": "ZOLL®, ein Unternehmen von Asahi Kasei, entwickelt und vermarktet Medizinprodukte und Softwarelösungen, die dazu beitragen, die Notfallversorgung zu verbessern, Leben zu retten und zugleich die klinische und betriebliche Effizienz steigern. Mit Produkten in den Bereichen Defibrillation und kardiale Überwachung, Kreislaufverbesserung und Feedback zur Wiederbelebung, SuperSaturated-Oxygen-Therapie, Datenmanagement, Beatmung, therapeutisches Temperaturmanagement und Diagnose sowie Behandlung von Schlafapnoe bietet ZOLL ein umfassendes Angebot an Technologien, die Klinikpersonal, den Rettungsdienst und Feuerwehrleute sowie Ersthelfer bei besseren Patientenergebnissen in kardiopulmonalen Notfällen unterstützen. Weitere Informationen finden Sie auf unserer Website www.zoll.com/de.",
        "p2": "Für die Asahi Kasei Gruppe steht Leben weltweit an erster Stelle. Asahi Kasei wurde im Jahr 1922 als Unternehmen für Ammoniak- und Zellulosefasern gegründet. Seitdem wächst es konstant durch die proaktive Wandlung seines Geschäftsportfolios, mit dem es wachsenden Anforderungen jeder Altersgruppe nachkommt. Mit weltweit mehr als 40.000 Mitarbeitern trägt das Unternehmen zu einer nachhaltigen Gesellschaft bei. Hierzu bietet es mit seinen drei Geschäftsbereichen Grundstoffe, Wohnbau und Gesundheitswesen Lösungen auf weltweite Herausforderungen. Zu ihren Tätigkeiten im Gesundheitswesen gehören Geräte und Systeme für akute Intensivpflege, Dialyse, therapeutische Apherese und Transfusion sowie Herstellung von Biotherapeutika, Pharmazeutika und diagnostischen Reagenzien. Weitere Informationen erhalten Sie unter www.asahi-kasei.com."
      },
      "Sentence": {
        "s1": "ZOLL®, ein Unternehmen von Asahi Kasei, entwickelt und vermarktet Medizinprodukte und Softwarelösungen, die dazu beitragen, die Notfallversorgung zu verbessern, Leben zu retten und zugleich die klinische und betriebliche Effizienz steigern",
        "s2": "Mit Produkten in den Bereichen Defibrillation und kardiale Überwachung, Kreislaufverbesserung und Feedback zur Wiederbelebung, SuperSaturated-Oxygen-Therapie, Datenmanagement, Beatmung, therapeutisches Temperaturmanagement und Diagnose sowie Behandlung von Schlafapnoe bietet ZOLL ein umfassendes Angebot an Technologien, die Klinikpersonal, den Rettungsdienst und Feuerwehrleute sowie Ersthelfer bei besseren Patientenergebnissen in kardiopulmonalen Notfällen unterstützen",
        "s3": "Weitere Informationen finden Sie auf unserer Website www.zoll.com/de",
        "s4": "Für die Asahi Kasei Gruppe steht Leben weltweit an erster Stelle",
        "s5": "Asahi Kasei wurde im Jahr 1922 als Unternehmen für Ammoniak- und Zellulosefasern gegründet",
        "s6": "Seitdem wächst es konstant durch die proaktive Wandlung seines Geschäftsportfolios, mit dem es wachsenden Anforderungen jeder Altersgruppe nachkommt",
        "s7": "Mit weltweit mehr als 40.000 Mitarbeitern trägt das Unternehmen zu einer nachhaltigen Gesellschaft bei",
        "s8": "Hierzu bietet es mit seinen drei Geschäftsbereichen Grundstoffe, Wohnbau und Gesundheitswesen Lösungen auf weltweite Herausforderungen",
        "s9": "Zu ihren Tätigkeiten im Gesundheitswesen gehören Geräte und Systeme für akute Intensivpflege, Dialyse, therapeutische Apherese und Transfusion sowie Herstellung von Biotherapeutika, Pharmazeutika und diagnostischen Reagenzien",
        "s10": "Weitere Informationen erhalten Sie unter www.asahi-kasei.com"
      },
      "WholeText": "ZOLL®, ein Unternehmen von Asahi Kasei, entwickelt und vermarktet Medizinprodukte und Softwarelösungen, die dazu beitragen, die Notfallversorgung zu verbessern, Leben zu retten und zugleich die klinische und betriebliche Effizienz steigern. Mit Produkten in den Bereichen Defibrillation und kardiale Überwachung, Kreislaufverbesserung und Feedback zur Wiederbelebung, SuperSaturated-Oxygen-Therapie, Datenmanagement, Beatmung, therapeutisches Temperaturmanagement und Diagnose sowie Behandlung von Schlafapnoe bietet ZOLL ein umfassendes Angebot an Technologien, die Klinikpersonal, den Rettungsdienst und Feuerwehrleute sowie Ersthelfer bei besseren Patientenergebnissen in kardiopulmonalen Notfällen unterstützen. Weitere Informationen finden Sie auf unserer Website www.zoll.com/de. Für die Asahi Kasei Gruppe steht Leben weltweit an erster Stelle. Asahi Kasei wurde im Jahr 1922 als Unternehmen für Ammoniak- und Zellulosefasern gegründet. Seitdem wächst es konstant durch die proaktive Wandlung seines Geschäftsportfolios, mit dem es wachsenden Anforderungen jeder Altersgruppe nachkommt. Mit weltweit mehr als 40.000 Mitarbeitern trägt das Unternehmen zu einer nachhaltigen Gesellschaft bei. Hierzu bietet es mit seinen drei Geschäftsbereichen Grundstoffe, Wohnbau und Gesundheitswesen Lösungen auf weltweite Herausforderungen. Zu ihren Tätigkeiten im Gesundheitswesen gehören Geräte und Systeme für akute Intensivpflege, Dialyse, therapeutische Apherese und Transfusion sowie Herstellung von Biotherapeutika, Pharmazeutika und diagnostischen Reagenzien. Weitere Informationen erhalten Sie unter www.asahi-kasei.com."
    }
  },
  {
    "Company": {
      "key": "supplier-os-org-sub~9943117",
      "name": "Petrella",
      "website": "https://www.petrella.de/unternehmen"
    },
    "AboutUs": {
      "Summary": "Nachhaltig zu produzieren bedeutet für uns, respektvoll und fair mit den Mitarbeiterinnen und Mitarbeitern umzugehen, in acht verschiedenen Ausbildungsberufen auszubilden, regelmäßig Weiterbildungen und Schulungen anzubieten und Teamarbeit sowie die eigene Verwirklichung im Unternehmen zu fördern",
      "Paragraph": {
        "p1": "Zwischen Hameln, Holzminden und Bad Pyrmont, inmitten von Wäldern und Wiesen gelegen, in einem kleinen 100-Seelendorf befindet sich der Standort unserer Familienmolkerei von Petri Feinkost. Hier produzieren wir im Einklang mit der Natur und unter Berücksichtigung strenger Nachhaltigkeitsrichtlinien sowie der Philosophie der Gründer unseren leckeren Petrella Frischkäse mit frischen und handverlesenen Zutaten. Unser Familienunternehmen wurde im Jahr 1962 von Claus und Waltraud Petri gegründet und wird heute von deren beiden Söhnen in zweiter Generation weitergeführt. Was vor 58 Jahren in der heimischen Küche mit einem Krups-Mixer begann, hat sich zu einer wahren Erfolgsgeschichte der Molkereibranche entwickelt. Petri Feinkost ist einer der erfolgreichsten milchverarbeitenden Betriebe Deutschlands. Und nicht nur das beliebteste Produkt, der Petrella Schnittlauch, ist in der gesamten Republik und weit über die deutschen Grenzen hinaus bekannt und beliebt. Auch die vielen anderen Petrella Sorten in unterschiedlichen Gebindegrößen sowie unsere schnittfesten Frischkäserollen und auch die gefüllten Frischkäsepralinen gelten für viele unserer Kundinnen und Kunden als wichtiges Nahrungsmittel, das täglich im Kühlschrank vorrätig sein muss. Gut, dass es unseren Petrella in nahezu jedem Supermarkt in Deutschland zu finden gibt.",
        "p2": "Das Petrella Identitätskennzeichen ist die einzigartige Qualität und Frische der Produkte. In unseren leckeren Frischkäse gelangen nur ausgewählte und handsortierte Zutaten – Frische, die man sieht und schmeckt.",
        "p3": "Damals wie heute sind wir von Petrella den drei Grundpfeilern „Tradition“, „Regionalität“ und „Nachhaltigkeit“ verpflichtet. Neben unseren hochmodernen, computergestützten und cpu-gesteuerten Anlagen, die von gut ausgebildeten Milchtechnologen in der hauseigenen Molkerei bedient werden, legen wir größten Wert auf traditionelle Herstellungsverfahren zur Produktion unserer cremigen Frischkäsezubereitungen. Durch das schonende Tuchpressverfahren „reift“ unser Frischkäse im Leinentuch und erhält dadurch seinen unverwechselbaren Geschmack und die einzigartige Cremigkeit.",
        "p4": "Wir von Petrella sind einer der großen Arbeitgeber im Landkreis Holzminden. Unsere ca. 330 Mitarbeiterinnen und Mitarbeiter wohnen fast alle im näheren Umkreis von Glesse, unserem Firmenstandort. Auch unsere Hauptzutat für den Petrella Frischkäse, die gute Kuhmilch, erhalten wir von den Milchbauern des Weserberglandes, die in einem Umkreis von 50 km rund um das Glessetal ihren Milchhof haben. Unsere hauseigenen Milchsammelwagen fahren in einem regelmäßigen Rhythmus von Hof zu Hof und holen die Milch bei den Milchbauern des Weserberglandes ab. Wenn unsere Fahrer mit einem vollen Milchtank zu unserer Molkerei zurückkehren, wird die Milch von den Milchtechnologen geprüft, in die entsprechenden Tanks geleitet und für die Weiterverarbeitung vorbereitet.",
        "p5": "Auch die soziale Verantwortung für das Weserbergland ist unserem Familienunternehmen sehr wichtig. So engagieren wir uns für verschiedenste regionale Projekte und Vereine und unterstützen Kindergärten und Schulen bei ihrem wöchentlichen, gesunden (Schul-)Frühstück mit unserem leckeren Petrella Frischkäse.",
        "p6": "Nachhaltigkeit ist für uns nicht nur eine Floskel, sondern eine Einstellung. Nachhaltig zu produzieren bedeutet für uns, respektvoll und fair mit den Mitarbeiterinnen und Mitarbeitern umzugehen, in acht verschiedenen Ausbildungsberufen auszubilden, regelmäßig Weiterbildungen und Schulungen anzubieten und Teamarbeit sowie die eigene Verwirklichung im Unternehmen zu fördern. Die Reduktion von Abfallmengen, die Verringerung des Wasserverbrauchs sowie die Errichtung eines hocheffizienten Energietrakts sind Schritte auf dem Weg zu einer noch nachhaltigeren Produktion. Seit 2015 sind wir durch unsere ISO 50001-Zertifizierung nun auch offiziell einem Energiemanagementsystem verpflichtet.",
        "p7": "Auch im Hinblick auf unseren Hauptrohstoff die Kuhmilch agieren wir nachhaltig. Unseren Lieferanten gegenüber haben wir Richtlinien für den Kuhkomfort aufgestellt, um den Kühen zum Beispiel den Verzicht der Anbindehaltung sowie eine ausreichend große Stall- und Weidefläche zu gewährleisten."
      },
      "Sentence": {
        "s1": "Zwischen Hameln, Holzminden und Bad Pyrmont, inmitten von Wäldern und Wiesen gelegen, in einem kleinen 100-Seelendorf befindet sich der Standort unserer Familienmolkerei von Petri Feinkost",
        "s2": "Hier produzieren wir im Einklang mit der Natur und unter Berücksichtigung strenger Nachhaltigkeitsrichtlinien sowie der Philosophie der Gründer unseren leckeren Petrella Frischkäse mit frischen und handverlesenen Zutaten',",
        "s3": "Unser Familienunternehmen wurde im Jahr 1962 von Claus und Waltraud Petri gegründet und wird heute von deren beiden Söhnen in zweiter Generation weitergeführt",
        "s4": "Was vor 58 Jahren in der heimischen Küche mit einem Krups-Mixer begann, hat sich zu einer wahren Erfolgsgeschichte der Molkereibranche entwickelt",
        "s5": "Petri Feinkost ist einer der erfolgreichsten milchverarbeitenden Betriebe Deutschlands",
        "s6": "Und nicht nur das beliebteste Produkt, der Petrella Schnittlauch, ist in der gesamten Republik und weit über die deutschen Grenzen hinaus bekannt und beliebt",
        "s7": "Auch die vielen anderen Petrella Sorten in unterschiedlichen Gebindegrößen sowie unsere schnittfesten Frischkäserollen und auch die gefüllten Frischkäsepralinen gelten für viele unserer Kundinnen und Kunden als wichtiges Nahrungsmittel, das täglich im Kühlschrank vorrätig sein muss",
        "s8": "Gut, dass es unseren Petrella in nahezu jedem Supermarkt in Deutschland zu finden gibt",
        "s9": "Das Petrella Identitätskennzeichen ist die einzigartige Qualität und Frische der Produkte",
        "s10": "In unseren leckeren Frischkäse gelangen nur ausgewählte und handsortierte Zutaten – Frische, die man sieht und schmeckt",
        "s11": "Damals wie heute sind wir von Petrella den drei Grundpfeilern „Tradition“, „Regionalität“ und „Nachhaltigkeit“ verpflichtet",
        "s12": "Neben unseren hochmodernen, computergestützten und cpu-gesteuerten Anlagen, die von gut ausgebildeten Milchtechnologen in der hauseigenen Molkerei bedient werden, legen wir größten Wert auf traditionelle Herstellungsverfahren zur Produktion unserer cremigen Frischkäsezubereitungen",
        "s13": "Durch das schonende Tuchpressverfahren „reift“ unser Frischkäse im Leinentuch und erhält dadurch seinen unverwechselbaren Geschmack und die einzigartige Cremigkeit",
        "s14": "Wir von Petrella sind einer der großen Arbeitgeber im Landkreis Holzminden",
        "s15": "Unsere ca 330 Mitarbeiterinnen und Mitarbeiter wohnen fast alle im näheren Umkreis von Glesse, unserem Firmenstandort",
        "s16": "Auch unsere Hauptzutat für den Petrella Frischkäse, die gute Kuhmilch, erhalten wir von den Milchbauern des Weserberglandes, die in einem Umkreis von 50 km rund um das Glessetal ihren Milchhof haben",
        "s17": "Unsere hauseigenen Milchsammelwagen fahren in einem regelmäßigen Rhythmus von Hof zu Hof und holen die Milch bei den Milchbauern des Weserberglandes ab",
        "s18": "Wenn unsere Fahrer mit einem vollen Milchtank zu unserer Molkerei zurückkehren, wird die Milch von den Milchtechnologen geprüft, in die entsprechenden Tanks geleitet und für die Weiterverarbeitung vorbereitet",
        "s19": "Auch die soziale Verantwortung für das Weserbergland ist unserem Familienunternehmen sehr wichtig",
        "s20": "So engagieren wir uns für verschiedenste regionale Projekte und Vereine und unterstützen Kindergärten und Schulen bei ihrem wöchentlichen, gesunden (Schul-)Frühstück mit unserem leckeren Petrella Frischkäse",
        "s21": "Nachhaltigkeit ist für uns nicht nur eine Floskel, sondern eine Einstellung",
        "s22": "Nachhaltig zu produzieren bedeutet für uns, respektvoll und fair mit den Mitarbeiterinnen und Mitarbeitern umzugehen, in acht verschiedenen Ausbildungsberufen auszubilden, regelmäßig Weiterbildungen und Schulungen anzubieten und Teamarbeit sowie die eigene Verwirklichung im Unternehmen zu fördern",
        "s23": "Die Reduktion von Abfallmengen, die Verringerung des Wasserverbrauchs sowie die Errichtung eines hocheffizienten Energietrakts sind Schritte auf dem Weg zu einer noch nachhaltigeren Produktion",
        "s24": "Seit 2015 sind wir durch unsere ISO 50001-Zertifizierung nun auch offiziell einem Energiemanagementsystem verpflichtet",
        "s25": "Auch im Hinblick auf unseren Hauptrohstoff die Kuhmilch agieren wir nachhaltig",
        "s26": "Unseren Lieferanten gegenüber haben wir Richtlinien für den Kuhkomfort aufgestellt, um den Kühen zum Beispiel den Verzicht der Anbindehaltung sowie eine ausreichend große Stall- und Weidefläche zu gewährleisten"
      },
      "WholeText": "Zwischen Hameln, Holzminden und Bad Pyrmont, inmitten von Wäldern und Wiesen gelegen, in einem kleinen 100-Seelendorf befindet sich der Standort unserer Familienmolkerei von Petri Feinkost. Hier produzieren wir im Einklang mit der Natur und unter Berücksichtigung strenger Nachhaltigkeitsrichtlinien sowie der Philosophie der Gründer unseren leckeren Petrella Frischkäse mit frischen und handverlesenen Zutaten. Unser Familienunternehmen wurde im Jahr 1962 von Claus und Waltraud Petri gegründet und wird heute von deren beiden Söhnen in zweiter Generation weitergeführt. Was vor 58 Jahren in der heimischen Küche mit einem Krups-Mixer begann, hat sich zu einer wahren Erfolgsgeschichte der Molkereibranche entwickelt. Petri Feinkost ist einer der erfolgreichsten milchverarbeitenden Betriebe Deutschlands. Und nicht nur das beliebteste Produkt, der Petrella Schnittlauch, ist in der gesamten Republik und weit über die deutschen Grenzen hinaus bekannt und beliebt. Auch die vielen anderen Petrella Sorten in unterschiedlichen Gebindegrößen sowie unsere schnittfesten Frischkäserollen und auch die gefüllten Frischkäsepralinen gelten für viele unserer Kundinnen und Kunden als wichtiges Nahrungsmittel, das täglich im Kühlschrank vorrätig sein muss. Gut, dass es unseren Petrella in nahezu jedem Supermarkt in Deutschland zu finden gibt. Das Petrella Identitätskennzeichen ist die einzigartige Qualität und Frische der Produkte. In unseren leckeren Frischkäse gelangen nur ausgewählte und handsortierte Zutaten – Frische, die man sieht und schmeckt. Damals wie heute sind wir von Petrella den drei Grundpfeilern „Tradition“, „Regionalität“ und „Nachhaltigkeit“ verpflichtet. Neben unseren hochmodernen, computergestützten und cpu-gesteuerten Anlagen, die von gut ausgebildeten Milchtechnologen in der hauseigenen Molkerei bedient werden, legen wir größten Wert auf traditionelle Herstellungsverfahren zur Produktion unserer cremigen Frischkäsezubereitungen. Durch das schonende Tuchpressverfahren „reift“ unser Frischkäse im Leinentuch und erhält dadurch seinen unverwechselbaren Geschmack und die einzigartige Cremigkeit. Wir von Petrella sind einer der großen Arbeitgeber im Landkreis Holzminden. Unsere ca. 330 Mitarbeiterinnen und Mitarbeiter wohnen fast alle im näheren Umkreis von Glesse, unserem Firmenstandort. Auch unsere Hauptzutat für den Petrella Frischkäse, die gute Kuhmilch, erhalten wir von den Milchbauern des Weserberglandes, die in einem Umkreis von 50 km rund um das Glessetal ihren Milchhof haben. Unsere hauseigenen Milchsammelwagen fahren in einem regelmäßigen Rhythmus von Hof zu Hof und holen die Milch bei den Milchbauern des Weserberglandes ab. Wenn unsere Fahrer mit einem vollen Milchtank zu unserer Molkerei zurückkehren, wird die Milch von den Milchtechnologen geprüft, in die entsprechenden Tanks geleitet und für die Weiterverarbeitung vorbereitet. Auch die soziale Verantwortung für das Weserbergland ist unserem Familienunternehmen sehr wichtig. So engagieren wir uns für verschiedenste regionale Projekte und Vereine und unterstützen Kindergärten und Schulen bei ihrem wöchentlichen, gesunden (Schul-)Frühstück mit unserem leckeren Petrella Frischkäse. Nachhaltigkeit ist für uns nicht nur eine Floskel, sondern eine Einstellung. Nachhaltig zu produzieren bedeutet für uns, respektvoll und fair mit den Mitarbeiterinnen und Mitarbeitern umzugehen, in acht verschiedenen Ausbildungsberufen auszubilden, regelmäßig Weiterbildungen und Schulungen anzubieten und Teamarbeit sowie die eigene Verwirklichung im Unternehmen zu fördern. Die Reduktion von Abfallmengen, die Verringerung des Wasserverbrauchs sowie die Errichtung eines hocheffizienten Energietrakts sind Schritte auf dem Weg zu einer noch nachhaltigeren Produktion. Seit 2015 sind wir durch unsere ISO 50001-Zertifizierung nun auch offiziell einem Energiemanagementsystem verpflichtet. Auch im Hinblick auf unseren Hauptrohstoff die Kuhmilch agieren wir nachhaltig. Unseren Lieferanten gegenüber haben wir Richtlinien für den Kuhkomfort aufgestellt, um den Kühen zum Beispiel den Verzicht der Anbindehaltung sowie eine ausreichend große Stall- und Weidefläche zu gewährleisten."
    }
  }
]